00:00.0 Host bridge [0600]: Intel Corporation Mobile 4 Series Chipset Memory Controller Hub [8086:2a40] (rev 07)
	Subsystem: Lenovo Device [17aa:20e0]
	Control: I/O- Mem+ BusMaster+ SpecCycle- MemWINV- VGASnoop- ParErr- Stepping- SERR+ FastB2B- DisINTx-
	Status: Cap+ 66MHz- UDF- FastB2B+ ParErr- DEVSEL=fast >TAbort- <TAbort- <MAbort+ >SERR- <PERR- INTx-
	Latency: 0
	Capabilities: [e0] Vendor Specific Information: Len=0a <?>
	Kernel driver in use: agpgart-intel
00: 86 80 40 2a 06 01 90 20 07 00 00 06 00 00 00 00
10: 00 00 00 00 00 00 00 00 00 00 00 00 00 00 00 00
20: 00 00 00 00 00 00 00 00 00 00 00 00 aa 17 e0 20
30: 00 00 00 00 e0 00 00 00 00 00 00 00 00 00 00 00
40: 01 90 d1 fe 00 00 00 00 01 00 d1 fe 00 00 00 00
50: 00 00 50 03 59 00 00 00 00 00 00 00 00 00 00 00
60: 01 00 00 e0 00 00 00 00 01 80 d1 fe 00 00 00 00
70: 01 00 40 bc 00 00 00 00 01 10 00 00 00 00 00 00
80: 00 00 00 00 00 00 00 00 00 00 00 00 00 00 00 00
90: 10 11 11 01 30 11 11 00 ff 03 00 00 00 1a 3b 00
a0: 18 00 f0 0b 00 00 00 00 00 00 00 00 00 00 00 00
b0: 00 bc 00 00 00 00 00 00 00 00 00 00 00 00 00 00
c0: 00 00 00 00 00 00 00 00 00 00 00 00 00 00 00 00
d0: 00 00 00 00 00 00 00 00 00 00 00 00 91 02 00 00
e0: 09 00 0a 11 88 64 00 1c 01 00 00 00 00 00 00 00
f0: 01 00 00 00 00 00 00 00 a0 0f 07 00 00 00 00 00
100: 00 00 00 00 00 00 00 00 00 00 00 00 00 00 00 00
110: 00 00 00 00 00 00 00 00 00 00 00 00 00 00 00 00
120: 00 00 00 00 00 00 00 00 00 00 00 00 00 00 00 00
130: 00 00 00 00 00 00 00 00 00 00 00 00 00 00 00 00
140: 00 00 00 00 00 00 00 00 00 00 00 00 00 00 00 00
150: 00 00 00 00 00 00 00 00 00 00 00 00 00 00 00 00
160: 00 00 00 00 00 00 00 00 00 00 00 00 00 00 00 00
170: 00 00 00 00 00 00 00 00 00 00 00 00 00 00 00 00
180: 00 00 00 00 00 00 00 00 00 00 00 00 00 00 00 00
190: 00 00 00 00 00 00 00 00 00 00 00 00 00 00 00 00
1a0: 00 00 00 00 00 00 00 00 00 00 00 00 00 00 00 00
1b0: 00 00 00 00 00 00 00 00 00 00 00 00 00 00 00 00
1c0: 00 00 00 00 00 00 00 00 00 00 00 00 00 00 00 00
1d0: 00 00 00 00 00 00 00 00 00 00 00 00 00 00 00 00
1e0: 00 00 00 00 00 00 00 00 00 00 00 00 00 00 00 00
1f0: 00 00 00 00 00 00 00 00 00 00 00 00 00 00 00 00
200: 00 00 00 00 00 00 00 00 00 00 00 00 00 00 00 00
210: 00 00 00 00 00 00 00 00 00 00 00 00 00 00 00 00
220: 00 00 00 00 00 00 00 00 00 00 00 00 00 00 00 00
230: 00 00 00 00 00 00 00 00 00 00 00 00 00 00 00 00
240: 00 00 00 00 00 00 00 00 00 00 00 00 00 00 00 00
250: 00 00 00 00 00 00 00 00 00 00 00 00 00 00 00 00
260: 00 00 00 00 00 00 00 00 00 00 00 00 00 00 00 00
270: 00 00 00 00 00 00 00 00 00 00 00 00 00 00 00 00
280: 00 00 00 00 00 00 00 00 00 00 00 00 00 00 00 00
290: 00 00 00 00 00 00 00 00 00 00 00 00 00 00 00 00
2a0: 00 00 00 00 00 00 00 00 00 00 00 00 00 00 00 00
2b0: 00 00 00 00 00 00 00 00 00 00 00 00 00 00 00 00
2c0: 00 00 00 00 00 00 00 00 00 00 00 00 00 00 00 00
2d0: 00 00 00 00 00 00 00 00 00 00 00 00 00 00 00 00
2e0: 00 00 00 00 00 00 00 00 00 00 00 00 00 00 00 00
2f0: 00 00 00 00 00 00 00 00 00 00 00 00 00 00 00 00
300: 00 00 00 00 00 00 00 00 00 00 00 00 00 00 00 00
310: 00 00 00 00 00 00 00 00 00 00 00 00 00 00 00 00
320: 00 00 00 00 00 00 00 00 00 00 00 00 00 00 00 00
330: 00 00 00 00 00 00 00 00 00 00 00 00 00 00 00 00
340: 00 00 00 00 00 00 00 00 00 00 00 00 00 00 00 00
350: 00 00 00 00 00 00 00 00 00 00 00 00 00 00 00 00
360: 00 00 00 00 00 00 00 00 00 00 00 00 00 00 00 00
370: 00 00 00 00 00 00 00 00 00 00 00 00 00 00 00 00
380: 00 00 00 00 00 00 00 00 00 00 00 00 00 00 00 00
390: 00 00 00 00 00 00 00 00 00 00 00 00 00 00 00 00
3a0: 00 00 00 00 00 00 00 00 00 00 00 00 00 00 00 00
3b0: 00 00 00 00 00 00 00 00 00 00 00 00 00 00 00 00
3c0: 00 00 00 00 00 00 00 00 00 00 00 00 00 00 00 00
3d0: 00 00 00 00 00 00 00 00 00 00 00 00 00 00 00 00
3e0: 00 00 00 00 00 00 00 00 00 00 00 00 00 00 00 00
3f0: 00 00 00 00 00 00 00 00 00 00 00 00 00 00 00 00
400: 00 00 00 00 00 00 00 00 00 00 00 00 00 00 00 00
410: 00 00 00 00 00 00 00 00 00 00 00 00 00 00 00 00
420: 00 00 00 00 00 00 00 00 00 00 00 00 00 00 00 00
430: 00 00 00 00 00 00 00 00 00 00 00 00 00 00 00 00
440: 00 00 00 00 00 00 00 00 00 00 00 00 00 00 00 00
450: 00 00 00 00 00 00 00 00 00 00 00 00 00 00 00 00
460: 00 00 00 00 00 00 00 00 00 00 00 00 00 00 00 00
470: 00 00 00 00 00 00 00 00 00 00 00 00 00 00 00 00
480: 00 00 00 00 00 00 00 00 00 00 00 00 00 00 00 00
490: 00 00 00 00 00 00 00 00 00 00 00 00 00 00 00 00
4a0: 00 00 00 00 00 00 00 00 00 00 00 00 00 00 00 00
4b0: 00 00 00 00 00 00 00 00 00 00 00 00 00 00 00 00
4c0: 00 00 00 00 00 00 00 00 00 00 00 00 00 00 00 00
4d0: 00 00 00 00 00 00 00 00 00 00 00 00 00 00 00 00
4e0: 00 00 00 00 00 00 00 00 00 00 00 00 00 00 00 00
4f0: 00 00 00 00 00 00 00 00 00 00 00 00 00 00 00 00
500: 00 00 00 00 00 00 00 00 00 00 00 00 00 00 00 00
510: 00 00 00 00 00 00 00 00 00 00 00 00 00 00 00 00
520: 00 00 00 00 00 00 00 00 00 00 00 00 00 00 00 00
530: 00 00 00 00 00 00 00 00 00 00 00 00 00 00 00 00
540: 00 00 00 00 00 00 00 00 00 00 00 00 00 00 00 00
550: 00 00 00 00 00 00 00 00 00 00 00 00 00 00 00 00
560: 00 00 00 00 00 00 00 00 00 00 00 00 00 00 00 00
570: 00 00 00 00 00 00 00 00 00 00 00 00 00 00 00 00
580: 00 00 00 00 00 00 00 00 00 00 00 00 00 00 00 00
590: 00 00 00 00 00 00 00 00 00 00 00 00 00 00 00 00
5a0: 00 00 00 00 00 00 00 00 00 00 00 00 00 00 00 00
5b0: 00 00 00 00 00 00 00 00 00 00 00 00 00 00 00 00
5c0: 00 00 00 00 00 00 00 00 00 00 00 00 00 00 00 00
5d0: 00 00 00 00 00 00 00 00 00 00 00 00 00 00 00 00
5e0: 00 00 00 00 00 00 00 00 00 00 00 00 00 00 00 00
5f0: 00 00 00 00 00 00 00 00 00 00 00 00 00 00 00 00
600: 00 00 00 00 00 00 00 00 00 00 00 00 00 00 00 00
610: 00 00 00 00 00 00 00 00 00 00 00 00 00 00 00 00
620: 00 00 00 00 00 00 00 00 00 00 00 00 00 00 00 00
630: 00 00 00 00 00 00 00 00 00 00 00 00 00 00 00 00
640: 00 00 00 00 00 00 00 00 00 00 00 00 00 00 00 00
650: 00 00 00 00 00 00 00 00 00 00 00 00 00 00 00 00
660: 00 00 00 00 00 00 00 00 00 00 00 00 00 00 00 00
670: 00 00 00 00 00 00 00 00 00 00 00 00 00 00 00 00
680: 00 00 00 00 00 00 00 00 00 00 00 00 00 00 00 00
690: 00 00 00 00 00 00 00 00 00 00 00 00 00 00 00 00
6a0: 00 00 00 00 00 00 00 00 00 00 00 00 00 00 00 00
6b0: 00 00 00 00 00 00 00 00 00 00 00 00 00 00 00 00
6c0: 00 00 00 00 00 00 00 00 00 00 00 00 00 00 00 00
6d0: 00 00 00 00 00 00 00 00 00 00 00 00 00 00 00 00
6e0: 00 00 00 00 00 00 00 00 00 00 00 00 00 00 00 00
6f0: 00 00 00 00 00 00 00 00 00 00 00 00 00 00 00 00
700: 00 00 00 00 00 00 00 00 00 00 00 00 00 00 00 00
710: 00 00 00 00 00 00 00 00 00 00 00 00 00 00 00 00
720: 00 00 00 00 00 00 00 00 00 00 00 00 00 00 00 00
730: 00 00 00 00 00 00 00 00 00 00 00 00 00 00 00 00
740: 00 00 00 00 00 00 00 00 00 00 00 00 00 00 00 00
750: 00 00 00 00 00 00 00 00 00 00 00 00 00 00 00 00
760: 00 00 00 00 00 00 00 00 00 00 00 00 00 00 00 00
770: 00 00 00 00 00 00 00 00 00 00 00 00 00 00 00 00
780: 00 00 00 00 00 00 00 00 00 00 00 00 00 00 00 00
790: 00 00 00 00 00 00 00 00 00 00 00 00 00 00 00 00
7a0: 00 00 00 00 00 00 00 00 00 00 00 00 00 00 00 00
7b0: 00 00 00 00 00 00 00 00 00 00 00 00 00 00 00 00
7c0: 00 00 00 00 00 00 00 00 00 00 00 00 00 00 00 00
7d0: 00 00 00 00 00 00 00 00 00 00 00 00 00 00 00 00
7e0: 00 00 00 00 00 00 00 00 00 00 00 00 00 00 00 00
7f0: 00 00 00 00 00 00 00 00 00 00 00 00 00 00 00 00
800: 00 00 00 00 00 00 00 00 00 00 00 00 00 00 00 00
810: 00 00 00 00 00 00 00 00 00 00 00 00 00 00 00 00
820: 00 00 00 00 00 00 00 00 00 00 00 00 00 00 00 00
830: 00 00 00 00 00 00 00 00 00 00 00 00 00 00 00 00
840: 00 00 00 00 00 00 00 00 00 00 00 00 00 00 00 00
850: 00 00 00 00 00 00 00 00 00 00 00 00 00 00 00 00
860: 00 00 00 00 00 00 00 00 00 00 00 00 00 00 00 00
870: 00 00 00 00 00 00 00 00 00 00 00 00 00 00 00 00
880: 00 00 00 00 00 00 00 00 00 00 00 00 00 00 00 00
890: 00 00 00 00 00 00 00 00 00 00 00 00 00 00 00 00
8a0: 00 00 00 00 00 00 00 00 00 00 00 00 00 00 00 00
8b0: 00 00 00 00 00 00 00 00 00 00 00 00 00 00 00 00
8c0: 00 00 00 00 00 00 00 00 00 00 00 00 00 00 00 00
8d0: 00 00 00 00 00 00 00 00 00 00 00 00 00 00 00 00
8e0: 00 00 00 00 00 00 00 00 00 00 00 00 00 00 00 00
8f0: 00 00 00 00 00 00 00 00 00 00 00 00 00 00 00 00
900: 00 00 00 00 00 00 00 00 00 00 00 00 00 00 00 00
910: 00 00 00 00 00 00 00 00 00 00 00 00 00 00 00 00
920: 00 00 00 00 00 00 00 00 00 00 00 00 00 00 00 00
930: 00 00 00 00 00 00 00 00 00 00 00 00 00 00 00 00
940: 00 00 00 00 00 00 00 00 00 00 00 00 00 00 00 00
950: 00 00 00 00 00 00 00 00 00 00 00 00 00 00 00 00
960: 00 00 00 00 00 00 00 00 00 00 00 00 00 00 00 00
970: 00 00 00 00 00 00 00 00 00 00 00 00 00 00 00 00
980: 00 00 00 00 00 00 00 00 00 00 00 00 00 00 00 00
990: 00 00 00 00 00 00 00 00 00 00 00 00 00 00 00 00
9a0: 00 00 00 00 00 00 00 00 00 00 00 00 00 00 00 00
9b0: 00 00 00 00 00 00 00 00 00 00 00 00 00 00 00 00
9c0: 00 00 00 00 00 00 00 00 00 00 00 00 00 00 00 00
9d0: 00 00 00 00 00 00 00 00 00 00 00 00 00 00 00 00
9e0: 00 00 00 00 00 00 00 00 00 00 00 00 00 00 00 00
9f0: 00 00 00 00 00 00 00 00 00 00 00 00 00 00 00 00
a00: 00 00 00 00 00 00 00 00 00 00 00 00 00 00 00 00
a10: 00 00 00 00 00 00 00 00 00 00 00 00 00 00 00 00
a20: 00 00 00 00 00 00 00 00 00 00 00 00 00 00 00 00
a30: 00 00 00 00 00 00 00 00 00 00 00 00 00 00 00 00
a40: 00 00 00 00 00 00 00 00 00 00 00 00 00 00 00 00
a50: 00 00 00 00 00 00 00 00 00 00 00 00 00 00 00 00
a60: 00 00 00 00 00 00 00 00 00 00 00 00 00 00 00 00
a70: 00 00 00 00 00 00 00 00 00 00 00 00 00 00 00 00
a80: 00 00 00 00 00 00 00 00 00 00 00 00 00 00 00 00
a90: 00 00 00 00 00 00 00 00 00 00 00 00 00 00 00 00
aa0: 00 00 00 00 00 00 00 00 00 00 00 00 00 00 00 00
ab0: 00 00 00 00 00 00 00 00 00 00 00 00 00 00 00 00
ac0: 00 00 00 00 00 00 00 00 00 00 00 00 00 00 00 00
ad0: 00 00 00 00 00 00 00 00 00 00 00 00 00 00 00 00
ae0: 00 00 00 00 00 00 00 00 00 00 00 00 00 00 00 00
af0: 00 00 00 00 00 00 00 00 00 00 00 00 00 00 00 00
b00: 00 00 00 00 00 00 00 00 00 00 00 00 00 00 00 00
b10: 00 00 00 00 00 00 00 00 00 00 00 00 00 00 00 00
b20: 00 00 00 00 00 00 00 00 00 00 00 00 00 00 00 00
b30: 00 00 00 00 00 00 00 00 00 00 00 00 00 00 00 00
b40: 00 00 00 00 00 00 00 00 00 00 00 00 00 00 00 00
b50: 00 00 00 00 00 00 00 00 00 00 00 00 00 00 00 00
b60: 00 00 00 00 00 00 00 00 00 00 00 00 00 00 00 00
b70: 00 00 00 00 00 00 00 00 00 00 00 00 00 00 00 00
b80: 00 00 00 00 00 00 00 00 00 00 00 00 00 00 00 00
b90: 00 00 00 00 00 00 00 00 00 00 00 00 00 00 00 00
ba0: 00 00 00 00 00 00 00 00 00 00 00 00 00 00 00 00
bb0: 00 00 00 00 00 00 00 00 00 00 00 00 00 00 00 00
bc0: 00 00 00 00 00 00 00 00 00 00 00 00 00 00 00 00
bd0: 00 00 00 00 00 00 00 00 00 00 00 00 00 00 00 00
be0: 00 00 00 00 00 00 00 00 00 00 00 00 00 00 00 00
bf0: 00 00 00 00 00 00 00 00 00 00 00 00 00 00 00 00
c00: 00 00 00 00 00 00 00 00 00 00 00 00 00 00 00 00
c10: 00 00 00 00 00 00 00 00 00 00 00 00 00 00 00 00
c20: 00 00 00 00 00 00 00 00 00 00 00 00 00 00 00 00
c30: 00 00 00 00 00 00 00 00 00 00 00 00 00 00 00 00
c40: 00 00 00 00 00 00 00 00 00 00 00 00 00 00 00 00
c50: 00 00 00 00 00 00 00 00 00 00 00 00 00 00 00 00
c60: 00 00 00 00 00 00 00 00 00 00 00 00 00 00 00 00
c70: 00 00 00 00 00 00 00 00 00 00 00 00 00 00 00 00
c80: 00 00 00 00 00 00 00 00 00 00 00 00 00 00 00 00
c90: 00 00 00 00 00 00 00 00 00 00 00 00 00 00 00 00
ca0: 00 00 00 00 00 00 00 00 00 00 00 00 00 00 00 00
cb0: 00 00 00 00 00 00 00 00 00 00 00 00 00 00 00 00
cc0: 00 00 00 00 00 00 00 00 00 00 00 00 00 00 00 00
cd0: 00 00 00 00 00 00 00 00 00 00 00 00 00 00 00 00
ce0: 00 00 00 00 00 00 00 00 00 00 00 00 00 00 00 00
cf0: 00 00 00 00 00 00 00 00 00 00 00 00 00 00 00 00
d00: 00 00 00 00 00 00 00 00 00 00 00 00 00 00 00 00
d10: 00 00 00 00 00 00 00 00 00 00 00 00 00 00 00 00
d20: 00 00 00 00 00 00 00 00 00 00 00 00 00 00 00 00
d30: 00 00 00 00 00 00 00 00 00 00 00 00 00 00 00 00
d40: 00 00 00 00 00 00 00 00 00 00 00 00 00 00 00 00
d50: 00 00 00 00 00 00 00 00 00 00 00 00 00 00 00 00
d60: 00 00 00 00 00 00 00 00 00 00 00 00 00 00 00 00
d70: 00 00 00 00 00 00 00 00 00 00 00 00 00 00 00 00
d80: 00 00 00 00 00 00 00 00 00 00 00 00 00 00 00 00
d90: 00 00 00 00 00 00 00 00 00 00 00 00 00 00 00 00
da0: 00 00 00 00 00 00 00 00 00 00 00 00 00 00 00 00
db0: 00 00 00 00 00 00 00 00 00 00 00 00 00 00 00 00
dc0: 00 00 00 00 00 00 00 00 00 00 00 00 00 00 00 00
dd0: 00 00 00 00 00 00 00 00 00 00 00 00 00 00 00 00
de0: 00 00 00 00 00 00 00 00 00 00 00 00 00 00 00 00
df0: 00 00 00 00 00 00 00 00 00 00 00 00 00 00 00 00
e00: 00 00 00 00 00 00 00 00 00 00 00 00 00 00 00 00
e10: 00 00 00 00 00 00 00 00 00 00 00 00 00 00 00 00
e20: 00 00 00 00 00 00 00 00 00 00 00 00 00 00 00 00
e30: 00 00 00 00 00 00 00 00 00 00 00 00 00 00 00 00
e40: 00 00 00 00 00 00 00 00 00 00 00 00 00 00 00 00
e50: 00 00 00 00 00 00 00 00 00 00 00 00 00 00 00 00
e60: 00 00 00 00 00 00 00 00 00 00 00 00 00 00 00 00
e70: 00 00 00 00 00 00 00 00 00 00 00 00 00 00 00 00
e80: 00 00 00 00 00 00 00 00 00 00 00 00 00 00 00 00
e90: 00 00 00 00 00 00 00 00 00 00 00 00 00 00 00 00
ea0: 00 00 00 00 00 00 00 00 00 00 00 00 00 00 00 00
eb0: 00 00 00 00 00 00 00 00 00 00 00 00 00 00 00 00
ec0: 00 00 00 00 00 00 00 00 00 00 00 00 00 00 00 00
ed0: 00 00 00 00 00 00 00 00 00 00 00 00 00 00 00 00
ee0: 00 00 00 00 00 00 00 00 00 00 00 00 00 00 00 00
ef0: 00 00 00 00 00 00 00 00 00 00 00 00 00 00 00 00
f00: 00 00 00 00 00 00 00 00 00 00 00 00 00 00 00 00
f10: 00 00 00 00 00 00 00 00 00 00 00 00 00 00 00 00
f20: 00 00 00 00 00 00 00 00 00 00 00 00 00 00 00 00
f30: 00 00 00 00 00 00 00 00 00 00 00 00 00 00 00 00
f40: 00 00 00 00 00 00 00 00 00 00 00 00 00 00 00 00
f50: 00 00 00 00 00 00 00 00 00 00 00 00 00 00 00 00
f60: 00 00 00 00 00 00 00 00 00 00 00 00 00 00 00 00
f70: 00 00 00 00 00 00 00 00 00 00 00 00 00 00 00 00
f80: 00 00 00 00 00 00 00 00 00 00 00 00 00 00 00 00
f90: 00 00 00 00 00 00 00 00 00 00 00 00 00 00 00 00
fa0: 00 00 00 00 00 00 00 00 00 00 00 00 00 00 00 00
fb0: 00 00 00 00 00 00 00 00 00 00 00 00 00 00 00 00
fc0: 00 00 00 00 00 00 00 00 00 00 00 00 00 00 00 00
fd0: 00 00 00 00 00 00 00 00 00 00 00 00 00 00 00 00
fe0: 00 00 00 00 00 00 00 00 00 00 00 00 00 00 00 00
ff0: 00 00 00 00 00 00 00 00 00 00 00 00 00 00 00 00

00:02.0 VGA compatible controller [0300]: Intel Corporation Mobile 4 Series Chipset Integrated Graphics Controller [8086:2a42] (rev 07) (prog-if 00 [VGA controller])
	Subsystem: Lenovo Device [17aa:20e4]
	Control: I/O+ Mem+ BusMaster+ SpecCycle- MemWINV- VGASnoop- ParErr- Stepping- SERR- FastB2B- DisINTx+
	Status: Cap+ 66MHz- UDF- FastB2B+ ParErr- DEVSEL=fast >TAbort- <TAbort- <MAbort- >SERR- <PERR- INTx-
	Latency: 0
	Interrupt: pin A routed to IRQ 44
	Region 0: Memory at f2000000 (64-bit, non-prefetchable) [size=4M]
	Region 2: Memory at d0000000 (64-bit, prefetchable) [size=256M]
	Region 4: I/O ports at 1800 [size=8]
	Expansion ROM at <unassigned> [disabled]
	Capabilities: [90] MSI: Enable+ Count=1/1 Maskable- 64bit-
		Address: fee0300c  Data: 4142
	Capabilities: [d0] Power Management version 3
		Flags: PMEClk- DSI+ D1- D2- AuxCurrent=0mA PME(D0-,D1-,D2-,D3hot-,D3cold-)
		Status: D0 NoSoftRst- PME-Enable- DSel=0 DScale=0 PME-
	Kernel driver in use: i915
00: 86 80 42 2a 07 04 90 00 07 00 00 03 00 00 80 00
10: 04 00 00 f2 00 00 00 00 0c 00 00 d0 00 00 00 00
20: 01 18 00 00 00 00 00 00 00 00 00 00 aa 17 e4 20
30: 00 00 00 00 90 00 00 00 00 00 00 00 0b 01 00 00
40: 00 00 00 00 48 00 00 00 09 00 0a 11 88 64 00 1c
50: 01 00 50 03 19 00 00 00 00 00 00 00 00 00 00 ba
60: 00 00 00 00 00 00 02 00 00 00 00 00 00 00 00 00
70: 00 00 00 00 00 00 00 00 00 00 00 00 00 00 00 00
80: 00 00 00 00 00 00 00 00 00 00 00 00 00 00 00 00
90: 05 d0 01 00 0c 30 e0 fe 42 41 00 00 00 00 00 00
a0: 00 00 00 00 09 00 06 20 00 00 00 00 00 00 00 00
b0: 00 00 00 00 00 00 00 00 00 00 00 00 00 00 00 00
c0: 00 00 00 00 00 00 00 00 00 00 00 00 40 01 00 00
d0: 01 00 23 00 00 00 00 00 00 00 00 00 34 00 00 00
e0: 00 00 00 00 00 00 00 00 00 80 00 1a 41 20 00 00
f0: 0d 1c 34 07 eb 00 00 00 a0 0f 07 00 ea b0 b6 b9

00:02.1 Display controller [0380]: Intel Corporation Mobile 4 Series Chipset Integrated Graphics Controller [8086:2a43] (rev 07)
	Subsystem: Lenovo Device [17aa:20e4]
	Control: I/O+ Mem+ BusMaster+ SpecCycle- MemWINV- VGASnoop- ParErr- Stepping- SERR- FastB2B- DisINTx-
	Status: Cap+ 66MHz- UDF- FastB2B+ ParErr- DEVSEL=fast >TAbort- <TAbort- <MAbort- >SERR- <PERR- INTx-
	Latency: 0
	Region 0: Memory at f2400000 (64-bit, non-prefetchable) [size=1M]
	Capabilities: [d0] Power Management version 3
		Flags: PMEClk- DSI+ D1- D2- AuxCurrent=0mA PME(D0-,D1-,D2-,D3hot-,D3cold-)
		Status: D0 NoSoftRst- PME-Enable- DSel=0 DScale=0 PME-
00: 86 80 43 2a 07 00 90 00 07 00 80 03 00 00 80 00
10: 04 00 40 f2 00 00 00 00 00 00 00 00 00 00 00 00
20: 00 00 00 00 00 00 00 00 00 00 00 00 aa 17 e4 20
30: 00 00 00 00 d0 00 00 00 00 00 00 00 00 00 00 00
40: 00 00 00 00 48 00 00 00 09 00 0a 11 88 64 00 1c
50: 01 00 50 03 19 00 00 00 00 00 00 00 00 00 00 ba
60: 00 00 00 00 00 00 02 00 00 00 00 00 00 00 00 00
70: 00 00 00 00 00 00 00 00 00 00 00 00 00 00 00 00
80: 00 00 00 00 00 00 00 00 00 00 00 00 00 00 00 00
90: 00 00 00 00 00 00 00 00 00 00 00 00 00 00 00 00
a0: 00 00 00 00 00 00 00 00 00 00 00 00 00 00 00 00
b0: 00 00 00 00 00 00 00 00 00 00 00 00 00 00 00 00
c0: 00 00 00 00 00 00 00 00 00 00 00 00 40 01 00 00
d0: 01 00 23 00 00 00 00 00 00 00 00 00 34 00 00 00
e0: 00 00 00 00 00 00 00 00 00 00 00 00 00 00 00 00
f0: 0d 1c 34 07 eb 00 00 00 a0 0f 07 00 00 00 00 00

00:03.0 Communication controller [0780]: Intel Corporation Mobile 4 Series Chipset MEI Controller [8086:2a44] (rev 07)
	Subsystem: Lenovo Device [17aa:20e6]
	Control: I/O- Mem+ BusMaster+ SpecCycle- MemWINV- VGASnoop- ParErr- Stepping- SERR- FastB2B- DisINTx+
	Status: Cap+ 66MHz- UDF- FastB2B- ParErr- DEVSEL=fast >TAbort- <TAbort- <MAbort- >SERR- <PERR- INTx-
	Latency: 0
	Interrupt: pin A routed to IRQ 45
	Region 0: Memory at f2725800 (64-bit, non-prefetchable) [size=16]
	Capabilities: [50] Power Management version 3
		Flags: PMEClk- DSI- D1- D2- AuxCurrent=0mA PME(D0+,D1-,D2-,D3hot+,D3cold+)
		Status: D0 NoSoftRst+ PME-Enable- DSel=0 DScale=0 PME-
	Capabilities: [8c] MSI: Enable+ Count=1/1 Maskable- 64bit+
		Address: 00000000fee0300c  Data: 4152
	Kernel driver in use: mei_me
00: 86 80 44 2a 06 04 10 00 07 00 80 07 00 00 80 00
10: 04 58 72 f2 00 00 00 00 00 00 00 00 00 00 00 00
20: 00 00 00 00 00 00 00 00 00 00 00 00 aa 17 e6 20
30: 00 00 00 00 50 00 00 00 00 00 00 00 0b 01 00 00
40: 4a 02 0a 30 00 00 00 00 00 00 00 00 00 00 00 00
50: 01 8c 03 c8 08 00 00 00 00 00 00 00 00 00 00 00
60: 00 00 00 00 00 00 00 00 00 00 00 00 00 00 00 00
70: 00 00 00 00 00 00 00 00 00 00 00 00 00 00 00 00
80: 00 00 00 00 00 00 00 00 00 00 00 00 05 00 81 00
90: 0c 30 e0 fe 00 00 00 00 52 41 00 00 00 00 00 00
a0: 00 00 00 00 00 00 00 00 00 00 00 00 00 00 00 00
b0: 00 00 00 00 00 00 00 00 00 00 00 00 00 00 00 00
c0: 00 00 00 00 00 00 00 00 00 00 00 00 00 00 00 00
d0: 00 00 00 00 00 00 00 00 00 00 00 00 00 00 00 00
e0: 00 00 00 00 00 00 00 00 00 00 00 00 00 00 00 00
f0: 00 00 00 00 00 00 00 00 00 00 00 00 00 00 00 00

00:19.0 Ethernet controller [0200]: Intel Corporation 82567LF Gigabit Network Connection [8086:10bf] (rev 03)
	Subsystem: Lenovo Device [17aa:20ee]
	Control: I/O+ Mem+ BusMaster+ SpecCycle- MemWINV- VGASnoop- ParErr- Stepping- SERR+ FastB2B- DisINTx+
	Status: Cap+ 66MHz- UDF- FastB2B- ParErr- DEVSEL=fast >TAbort- <TAbort- <MAbort- >SERR- <PERR- INTx-
	Latency: 0
	Interrupt: pin A routed to IRQ 43
	Region 0: Memory at f2500000 (32-bit, non-prefetchable) [size=128K]
	Region 1: Memory at f2524000 (32-bit, non-prefetchable) [size=4K]
	Region 2: I/O ports at 1820 [size=32]
	Capabilities: [c8] Power Management version 2
		Flags: PMEClk- DSI+ D1- D2- AuxCurrent=0mA PME(D0+,D1-,D2-,D3hot+,D3cold+)
		Status: D0 NoSoftRst- PME-Enable- DSel=0 DScale=1 PME-
	Capabilities: [d0] MSI: Enable+ Count=1/1 Maskable- 64bit+
		Address: 00000000fee0300c  Data: 4182
	Capabilities: [e0] PCI Advanced Features
		AFCap: TP+ FLR+
		AFCtrl: FLR-
		AFStatus: TP-
	Kernel driver in use: e1000e
00: 86 80 bf 10 07 05 10 00 03 00 00 02 00 00 00 00
10: 00 00 50 f2 00 40 52 f2 21 18 00 00 00 00 00 00
20: 00 00 00 00 00 00 00 00 00 00 00 00 aa 17 ee 20
30: 00 00 00 00 c8 00 00 00 00 00 00 00 0b 01 00 00
40: 00 00 00 00 00 00 00 00 00 00 00 00 00 00 00 00
50: 00 00 00 00 00 00 00 00 00 00 00 00 00 00 00 00
60: 00 00 00 00 00 00 00 00 00 00 00 00 00 00 00 00
70: 00 00 00 00 00 00 00 00 00 00 00 00 00 00 00 00
80: 00 00 00 00 00 00 00 00 00 00 00 00 00 00 00 00
90: 00 00 00 00 00 00 00 00 00 00 00 00 00 00 00 00
a0: 00 00 00 00 00 00 00 00 00 00 00 00 00 00 00 00
b0: 00 00 00 00 00 00 00 00 00 00 00 00 00 00 00 00
c0: 00 00 00 00 00 00 00 00 01 d0 22 c8 00 20 00 0d
d0: 05 e0 81 00 0c 30 e0 fe 00 00 00 00 82 41 00 00
e0: 13 00 06 03 00 00 00 00 00 00 00 00 00 00 00 00
f0: 00 00 00 00 00 00 00 00 00 00 00 00 00 00 00 00

00:1a.0 USB controller [0c03]: Intel Corporation 82801I (ICH9 Family) USB UHCI Controller #4 [8086:2937] (rev 03) (prog-if 00 [UHCI])
	Subsystem: Lenovo Device [17aa:20f0]
	Control: I/O+ Mem- BusMaster+ SpecCycle- MemWINV- VGASnoop- ParErr- Stepping- SERR- FastB2B- DisINTx-
	Status: Cap+ 66MHz- UDF- FastB2B+ ParErr- DEVSEL=medium >TAbort- <TAbort- <MAbort- >SERR- <PERR- INTx-
	Latency: 0
	Interrupt: pin A routed to IRQ 20
	Region 4: I/O ports at 1840 [size=32]
	Capabilities: [50] PCI Advanced Features
		AFCap: TP+ FLR+
		AFCtrl: FLR-
		AFStatus: TP-
	Kernel driver in use: uhci_hcd
00: 86 80 37 29 05 00 90 02 03 00 03 0c 00 00 80 00
10: 00 00 00 00 00 00 00 00 00 00 00 00 00 00 00 00
20: 41 18 00 00 00 00 00 00 00 00 00 00 aa 17 f0 20
30: 00 00 00 00 50 00 00 00 00 00 00 00 0b 01 00 00
40: 00 00 00 00 00 00 00 00 00 00 00 00 00 00 00 00
50: 13 00 06 03 00 00 00 00 00 00 00 00 00 00 00 00
60: 10 00 00 00 00 00 00 00 00 00 00 00 00 00 00 00
70: 00 00 00 00 00 00 00 00 00 00 00 00 00 00 00 00
80: 00 00 00 00 00 00 00 00 00 00 00 00 00 00 00 00
90: 00 00 00 00 00 00 00 00 00 00 00 00 00 00 00 00
a0: 00 00 00 00 00 00 00 00 00 00 00 00 00 00 00 00
b0: 00 00 00 00 00 00 00 00 00 00 00 00 00 00 00 00
c0: 00 2f 00 00 00 00 00 00 00 00 01 00 00 00 00 00
d0: 00 00 00 00 00 00 00 00 00 00 00 00 00 00 00 00
e0: 00 00 00 00 00 00 00 00 00 00 00 00 00 00 00 00
f0: 00 00 00 00 00 00 00 00 86 0f 04 00 00 00 00 00

00:1a.1 USB controller [0c03]: Intel Corporation 82801I (ICH9 Family) USB UHCI Controller #5 [8086:2938] (rev 03) (prog-if 00 [UHCI])
	Subsystem: Lenovo Device [17aa:20f0]
	Control: I/O+ Mem- BusMaster+ SpecCycle- MemWINV- VGASnoop- ParErr- Stepping- SERR- FastB2B- DisINTx-
	Status: Cap+ 66MHz- UDF- FastB2B+ ParErr- DEVSEL=medium >TAbort- <TAbort- <MAbort- >SERR- <PERR- INTx-
	Latency: 0
	Interrupt: pin B routed to IRQ 21
	Region 4: I/O ports at 1860 [size=32]
	Capabilities: [50] PCI Advanced Features
		AFCap: TP+ FLR+
		AFCtrl: FLR-
		AFStatus: TP-
	Kernel driver in use: uhci_hcd
00: 86 80 38 29 05 00 90 02 03 00 03 0c 00 00 00 00
10: 00 00 00 00 00 00 00 00 00 00 00 00 00 00 00 00
20: 61 18 00 00 00 00 00 00 00 00 00 00 aa 17 f0 20
30: 00 00 00 00 50 00 00 00 00 00 00 00 0b 02 00 00
40: 00 00 00 00 00 00 00 00 00 00 00 00 00 00 00 00
50: 13 00 06 03 00 00 00 00 00 00 00 00 00 00 00 00
60: 10 00 00 00 00 00 00 00 00 00 00 00 00 00 00 00
70: 00 00 00 00 00 00 00 00 00 00 00 00 00 00 00 00
80: 00 00 00 00 00 00 00 00 00 00 00 00 00 00 00 00
90: 00 00 00 00 00 00 00 00 00 00 00 00 00 00 00 00
a0: 00 00 00 00 00 00 00 00 00 00 00 00 00 00 00 00
b0: 00 00 00 00 00 00 00 00 00 00 00 00 00 00 00 00
c0: 00 2f 00 00 00 00 00 00 00 00 01 00 00 00 00 00
d0: 00 00 00 00 00 00 00 00 00 00 00 00 00 00 00 00
e0: 00 00 00 00 00 00 00 00 00 00 00 00 00 00 00 00
f0: 00 00 00 00 00 00 00 00 86 0f 04 00 00 00 00 00

00:1a.2 USB controller [0c03]: Intel Corporation 82801I (ICH9 Family) USB UHCI Controller #6 [8086:2939] (rev 03) (prog-if 00 [UHCI])
	Subsystem: Lenovo Device [17aa:20f0]
	Control: I/O+ Mem- BusMaster+ SpecCycle- MemWINV- VGASnoop- ParErr- Stepping- SERR- FastB2B- DisINTx-
	Status: Cap+ 66MHz- UDF- FastB2B+ ParErr- DEVSEL=medium >TAbort- <TAbort- <MAbort- >SERR- <PERR- INTx-
	Latency: 0
	Interrupt: pin C routed to IRQ 22
	Region 4: I/O ports at 1880 [size=32]
	Capabilities: [50] PCI Advanced Features
		AFCap: TP+ FLR+
		AFCtrl: FLR-
		AFStatus: TP-
	Kernel driver in use: uhci_hcd
00: 86 80 39 29 05 00 90 02 03 00 03 0c 00 00 00 00
10: 00 00 00 00 00 00 00 00 00 00 00 00 00 00 00 00
20: 81 18 00 00 00 00 00 00 00 00 00 00 aa 17 f0 20
30: 00 00 00 00 50 00 00 00 00 00 00 00 0b 03 00 00
40: 00 00 00 00 00 00 00 00 00 00 00 00 00 00 00 00
50: 13 00 06 03 00 00 00 00 00 00 00 00 00 00 00 00
60: 10 00 00 00 00 00 00 00 00 00 00 00 00 00 00 00
70: 00 00 00 00 00 00 00 00 00 00 00 00 00 00 00 00
80: 00 00 00 00 00 00 00 00 00 00 00 00 00 00 00 00
90: 00 00 00 00 00 00 00 00 00 00 00 00 00 00 00 00
a0: 00 00 00 00 00 00 00 00 00 00 00 00 00 00 00 00
b0: 00 00 00 00 00 00 00 00 00 00 00 00 00 00 00 00
c0: 00 2f 00 00 00 00 00 00 00 00 01 00 00 00 00 00
d0: 00 00 00 00 00 00 00 00 00 00 00 00 00 00 00 00
e0: 00 00 00 00 00 00 00 00 00 00 00 00 00 00 00 00
f0: 00 00 00 00 00 00 00 00 86 0f 04 00 00 00 00 00

00:1a.7 USB controller [0c03]: Intel Corporation 82801I (ICH9 Family) USB2 EHCI Controller #2 [8086:293c] (rev 03) (prog-if 20 [EHCI])
	Subsystem: Lenovo Device [17aa:20f1]
	Control: I/O- Mem+ BusMaster+ SpecCycle- MemWINV- VGASnoop- ParErr- Stepping- SERR+ FastB2B- DisINTx-
	Status: Cap+ 66MHz- UDF- FastB2B+ ParErr- DEVSEL=medium >TAbort- <TAbort- <MAbort- >SERR- <PERR- INTx-
	Latency: 0
	Interrupt: pin D routed to IRQ 23
	Region 0: Memory at f2725c00 (32-bit, non-prefetchable) [size=1K]
	Capabilities: [50] Power Management version 2
		Flags: PMEClk- DSI- D1- D2- AuxCurrent=375mA PME(D0+,D1-,D2-,D3hot+,D3cold+)
		Status: D0 NoSoftRst- PME-Enable- DSel=0 DScale=0 PME-
	Capabilities: [58] Debug port: BAR=1 offset=00a0
	Capabilities: [98] PCI Advanced Features
		AFCap: TP+ FLR+
		AFCtrl: FLR-
		AFStatus: TP-
	Kernel driver in use: ehci-pci
00: 86 80 3c 29 06 01 90 02 03 20 03 0c 00 00 00 00
10: 00 5c 72 f2 00 00 00 00 00 00 00 00 00 00 00 00
20: 00 00 00 00 00 00 00 00 00 00 00 00 aa 17 f1 20
30: 00 00 00 00 50 00 00 00 00 00 00 00 0b 04 00 00
40: 00 00 00 00 00 00 00 00 00 00 00 00 00 00 00 00
50: 01 58 c2 c9 00 00 00 00 0a 98 a0 20 00 00 00 00
60: 20 20 ff 01 00 00 00 00 01 00 00 01 00 00 08 c0
70: 40 00 9f 0f 00 00 00 00 00 00 00 00 00 00 00 00
80: 00 00 00 00 01 00 00 00 00 00 00 00 00 00 00 00
90: 00 00 00 00 00 00 00 00 13 00 06 03 00 00 00 00
a0: 00 00 00 00 00 00 00 00 00 00 00 00 00 00 00 00
b0: 00 00 00 00 00 00 00 00 00 00 00 00 00 00 00 00
c0: 00 00 00 00 00 00 00 00 00 00 00 00 00 00 00 00
d0: 00 00 00 00 00 aa ff 00 00 00 00 00 00 00 00 00
e0: 00 00 00 00 00 00 00 00 00 00 00 00 00 00 00 00
f0: 00 00 00 00 88 85 40 00 86 0f 04 00 06 17 02 20

00:1b.0 Audio device [0403]: Intel Corporation 82801I (ICH9 Family) HD Audio Controller [8086:293e] (rev 03)
	Subsystem: Lenovo Device [17aa:20f2]
	Control: I/O- Mem+ BusMaster+ SpecCycle- MemWINV- VGASnoop- ParErr- Stepping- SERR+ FastB2B- DisINTx+
	Status: Cap+ 66MHz- UDF- FastB2B- ParErr- DEVSEL=fast >TAbort- <TAbort- <MAbort- >SERR- <PERR- INTx-
	Latency: 0, Cache Line Size: 64 bytes
	Interrupt: pin B routed to IRQ 46
	Region 0: Memory at f2520000 (64-bit, non-prefetchable) [size=16K]
	Capabilities: [50] Power Management version 2
		Flags: PMEClk- DSI- D1- D2- AuxCurrent=55mA PME(D0+,D1-,D2-,D3hot+,D3cold+)
		Status: D0 NoSoftRst- PME-Enable- DSel=0 DScale=0 PME-
	Capabilities: [60] MSI: Enable+ Count=1/1 Maskable- 64bit+
		Address: 00000000fee0300c  Data: 4162
	Capabilities: [70] Express (v1) Root Complex Integrated Endpoint, MSI 00
		DevCap:	MaxPayload 128 bytes, PhantFunc 0
			ExtTag- RBE-
		DevCtl:	Report errors: Correctable- Non-Fatal- Fatal- Unsupported-
			RlxdOrd- ExtTag- PhantFunc- AuxPwr- NoSnoop+
			MaxPayload 128 bytes, MaxReadReq 128 bytes
		DevSta:	CorrErr- UncorrErr- FatalErr- UnsuppReq- AuxPwr+ TransPend-
	Capabilities: [100 v1] Virtual Channel
		Caps:	LPEVC=0 RefClk=100ns PATEntryBits=1
		Arb:	Fixed- WRR32- WRR64- WRR128-
		Ctrl:	ArbSelect=Fixed
		Status:	InProgress-
		VC0:	Caps:	PATOffset=00 MaxTimeSlots=1 RejSnoopTrans-
			Arb:	Fixed- WRR32- WRR64- WRR128- TWRR128- WRR256-
			Ctrl:	Enable+ ID=0 ArbSelect=Fixed TC/VC=ff
			Status:	NegoPending- InProgress-
		VC1:	Caps:	PATOffset=00 MaxTimeSlots=1 RejSnoopTrans-
			Arb:	Fixed- WRR32- WRR64- WRR128- TWRR128- WRR256-
			Ctrl:	Enable- ID=0 ArbSelect=Fixed TC/VC=00
			Status:	NegoPending- InProgress-
	Capabilities: [130 v1] Root Complex Link
		Desc:	PortNumber=0f ComponentID=02 EltType=Config
		Link0:	Desc:	TargetPort=00 TargetComponent=02 AssocRCRB- LinkType=MemMapped LinkValid+
			Addr:	00000000fed1c000
	Kernel driver in use: snd_hda_intel
00: 86 80 3e 29 06 05 10 00 03 00 03 04 10 00 00 00
10: 04 00 52 f2 00 00 00 00 00 00 00 00 00 00 00 00
20: 00 00 00 00 00 00 00 00 00 00 00 00 aa 17 f2 20
30: 00 00 00 00 50 00 00 00 00 00 00 00 0b 02 00 00
40: 01 00 00 07 00 00 00 00 00 00 00 00 00 80 00 00
50: 01 60 42 c8 00 00 00 00 00 00 00 00 00 00 00 00
60: 05 70 81 00 0c 30 e0 fe 00 00 00 00 62 41 00 00
70: 10 00 91 00 00 00 00 10 00 08 10 00 00 00 00 00
80: 00 00 00 00 00 00 00 00 00 00 00 00 00 00 00 00
90: 00 00 00 00 00 00 00 00 00 00 00 00 00 00 00 00
a0: 00 00 00 00 00 00 00 00 00 00 00 00 00 00 00 00
b0: 00 00 00 00 00 00 00 00 00 00 00 00 00 00 00 00
c0: 00 04 00 01 00 00 00 00 31 00 a3 02 00 00 00 00
d0: 61 00 a3 02 00 00 00 00 00 00 00 00 00 00 00 00
e0: 00 00 00 00 00 00 00 00 00 00 00 00 00 00 00 00
f0: 00 00 00 00 00 00 00 00 86 0f 04 00 00 00 00 00
100: 02 00 01 13 01 00 00 00 00 00 00 00 00 00 00 00
110: 00 00 00 00 ff 00 00 80 00 00 00 00 00 00 00 00
120: 00 00 00 00 00 00 00 00 00 00 00 00 00 00 00 00
130: 05 00 01 00 00 01 02 0f 00 00 00 00 00 00 00 00
140: 01 00 02 00 00 00 00 00 00 c0 d1 fe 00 00 00 00
150: 00 00 00 00 00 00 00 00 00 00 00 00 00 00 00 00
160: 00 00 00 00 00 00 00 00 00 00 00 00 00 00 00 00
170: 00 00 00 00 00 00 00 00 00 00 00 00 00 00 00 00
180: 00 00 00 00 00 00 00 00 00 00 00 00 00 00 00 00
190: 00 00 00 00 00 00 00 00 00 00 00 00 00 00 00 00
1a0: 00 00 00 00 00 00 00 00 00 00 00 00 00 00 00 00
1b0: 00 00 00 00 00 00 00 00 00 00 00 00 00 00 00 00
1c0: 00 00 00 00 00 00 00 00 00 00 00 00 00 00 00 00
1d0: 00 00 00 00 00 00 00 00 00 00 00 00 00 00 00 00
1e0: 00 00 00 00 00 00 00 00 00 00 00 00 00 00 00 00
1f0: 00 00 00 00 00 00 00 00 00 00 00 00 00 00 00 00
200: 00 00 00 00 00 00 00 00 00 00 00 00 00 00 00 00
210: 00 00 00 00 00 00 00 00 00 00 00 00 00 00 00 00
220: 00 00 00 00 00 00 00 00 00 00 00 00 00 00 00 00
230: 00 00 00 00 00 00 00 00 00 00 00 00 00 00 00 00
240: 00 00 00 00 00 00 00 00 00 00 00 00 00 00 00 00
250: 00 00 00 00 00 00 00 00 00 00 00 00 00 00 00 00
260: 00 00 00 00 00 00 00 00 00 00 00 00 00 00 00 00
270: 00 00 00 00 00 00 00 00 00 00 00 00 00 00 00 00
280: 00 00 00 00 00 00 00 00 00 00 00 00 00 00 00 00
290: 00 00 00 00 00 00 00 00 00 00 00 00 00 00 00 00
2a0: 00 00 00 00 00 00 00 00 00 00 00 00 00 00 00 00
2b0: 00 00 00 00 00 00 00 00 00 00 00 00 00 00 00 00
2c0: 00 00 00 00 00 00 00 00 00 00 00 00 00 00 00 00
2d0: 00 00 00 00 00 00 00 00 00 00 00 00 00 00 00 00
2e0: 00 00 00 00 00 00 00 00 00 00 00 00 00 00 00 00
2f0: 00 00 00 00 00 00 00 00 00 00 00 00 00 00 00 00
300: 00 00 00 00 00 00 00 00 00 00 00 00 00 00 00 00
310: 00 00 00 00 00 00 00 00 00 00 00 00 00 00 00 00
320: 00 00 00 00 00 00 00 00 00 00 00 00 00 00 00 00
330: 00 00 00 00 00 00 00 00 00 00 00 00 00 00 00 00
340: 00 00 00 00 00 00 00 00 00 00 00 00 00 00 00 00
350: 00 00 00 00 00 00 00 00 00 00 00 00 00 00 00 00
360: 00 00 00 00 00 00 00 00 00 00 00 00 00 00 00 00
370: 00 00 00 00 00 00 00 00 00 00 00 00 00 00 00 00
380: 00 00 00 00 00 00 00 00 00 00 00 00 00 00 00 00
390: 00 00 00 00 00 00 00 00 00 00 00 00 00 00 00 00
3a0: 00 00 00 00 00 00 00 00 00 00 00 00 00 00 00 00
3b0: 00 00 00 00 00 00 00 00 00 00 00 00 00 00 00 00
3c0: 00 00 00 00 00 00 00 00 00 00 00 00 00 00 00 00
3d0: 00 00 00 00 00 00 00 00 00 00 00 00 00 00 00 00
3e0: 00 00 00 00 00 00 00 00 00 00 00 00 00 00 00 00
3f0: 00 00 00 00 00 00 00 00 00 00 00 00 00 00 00 00
400: 00 00 00 00 00 00 00 00 00 00 00 00 00 00 00 00
410: 00 00 00 00 00 00 00 00 00 00 00 00 00 00 00 00
420: 00 00 00 00 00 00 00 00 00 00 00 00 00 00 00 00
430: 00 00 00 00 00 00 00 00 00 00 00 00 00 00 00 00
440: 00 00 00 00 00 00 00 00 00 00 00 00 00 00 00 00
450: 00 00 00 00 00 00 00 00 00 00 00 00 00 00 00 00
460: 00 00 00 00 00 00 00 00 00 00 00 00 00 00 00 00
470: 00 00 00 00 00 00 00 00 00 00 00 00 00 00 00 00
480: 00 00 00 00 00 00 00 00 00 00 00 00 00 00 00 00
490: 00 00 00 00 00 00 00 00 00 00 00 00 00 00 00 00
4a0: 00 00 00 00 00 00 00 00 00 00 00 00 00 00 00 00
4b0: 00 00 00 00 00 00 00 00 00 00 00 00 00 00 00 00
4c0: 00 00 00 00 00 00 00 00 00 00 00 00 00 00 00 00
4d0: 00 00 00 00 00 00 00 00 00 00 00 00 00 00 00 00
4e0: 00 00 00 00 00 00 00 00 00 00 00 00 00 00 00 00
4f0: 00 00 00 00 00 00 00 00 00 00 00 00 00 00 00 00
500: 00 00 00 00 00 00 00 00 00 00 00 00 00 00 00 00
510: 00 00 00 00 00 00 00 00 00 00 00 00 00 00 00 00
520: 00 00 00 00 00 00 00 00 00 00 00 00 00 00 00 00
530: 00 00 00 00 00 00 00 00 00 00 00 00 00 00 00 00
540: 00 00 00 00 00 00 00 00 00 00 00 00 00 00 00 00
550: 00 00 00 00 00 00 00 00 00 00 00 00 00 00 00 00
560: 00 00 00 00 00 00 00 00 00 00 00 00 00 00 00 00
570: 00 00 00 00 00 00 00 00 00 00 00 00 00 00 00 00
580: 00 00 00 00 00 00 00 00 00 00 00 00 00 00 00 00
590: 00 00 00 00 00 00 00 00 00 00 00 00 00 00 00 00
5a0: 00 00 00 00 00 00 00 00 00 00 00 00 00 00 00 00
5b0: 00 00 00 00 00 00 00 00 00 00 00 00 00 00 00 00
5c0: 00 00 00 00 00 00 00 00 00 00 00 00 00 00 00 00
5d0: 00 00 00 00 00 00 00 00 00 00 00 00 00 00 00 00
5e0: 00 00 00 00 00 00 00 00 00 00 00 00 00 00 00 00
5f0: 00 00 00 00 00 00 00 00 00 00 00 00 00 00 00 00
600: 00 00 00 00 00 00 00 00 00 00 00 00 00 00 00 00
610: 00 00 00 00 00 00 00 00 00 00 00 00 00 00 00 00
620: 00 00 00 00 00 00 00 00 00 00 00 00 00 00 00 00
630: 00 00 00 00 00 00 00 00 00 00 00 00 00 00 00 00
640: 00 00 00 00 00 00 00 00 00 00 00 00 00 00 00 00
650: 00 00 00 00 00 00 00 00 00 00 00 00 00 00 00 00
660: 00 00 00 00 00 00 00 00 00 00 00 00 00 00 00 00
670: 00 00 00 00 00 00 00 00 00 00 00 00 00 00 00 00
680: 00 00 00 00 00 00 00 00 00 00 00 00 00 00 00 00
690: 00 00 00 00 00 00 00 00 00 00 00 00 00 00 00 00
6a0: 00 00 00 00 00 00 00 00 00 00 00 00 00 00 00 00
6b0: 00 00 00 00 00 00 00 00 00 00 00 00 00 00 00 00
6c0: 00 00 00 00 00 00 00 00 00 00 00 00 00 00 00 00
6d0: 00 00 00 00 00 00 00 00 00 00 00 00 00 00 00 00
6e0: 00 00 00 00 00 00 00 00 00 00 00 00 00 00 00 00
6f0: 00 00 00 00 00 00 00 00 00 00 00 00 00 00 00 00
700: 00 00 00 00 00 00 00 00 00 00 00 00 00 00 00 00
710: 00 00 00 00 00 00 00 00 00 00 00 00 00 00 00 00
720: 00 00 00 00 00 00 00 00 00 00 00 00 00 00 00 00
730: 00 00 00 00 00 00 00 00 00 00 00 00 00 00 00 00
740: 00 00 00 00 00 00 00 00 00 00 00 00 00 00 00 00
750: 00 00 00 00 00 00 00 00 00 00 00 00 00 00 00 00
760: 00 00 00 00 00 00 00 00 00 00 00 00 00 00 00 00
770: 00 00 00 00 00 00 00 00 00 00 00 00 00 00 00 00
780: 00 00 00 00 00 00 00 00 00 00 00 00 00 00 00 00
790: 00 00 00 00 00 00 00 00 00 00 00 00 00 00 00 00
7a0: 00 00 00 00 00 00 00 00 00 00 00 00 00 00 00 00
7b0: 00 00 00 00 00 00 00 00 00 00 00 00 00 00 00 00
7c0: 00 00 00 00 00 00 00 00 00 00 00 00 00 00 00 00
7d0: 00 00 00 00 00 00 00 00 00 00 00 00 00 00 00 00
7e0: 00 00 00 00 00 00 00 00 00 00 00 00 00 00 00 00
7f0: 00 00 00 00 00 00 00 00 00 00 00 00 00 00 00 00
800: 00 00 00 00 00 00 00 00 00 00 00 00 00 00 00 00
810: 00 00 00 00 00 00 00 00 00 00 00 00 00 00 00 00
820: 00 00 00 00 00 00 00 00 00 00 00 00 00 00 00 00
830: 00 00 00 00 00 00 00 00 00 00 00 00 00 00 00 00
840: 00 00 00 00 00 00 00 00 00 00 00 00 00 00 00 00
850: 00 00 00 00 00 00 00 00 00 00 00 00 00 00 00 00
860: 00 00 00 00 00 00 00 00 00 00 00 00 00 00 00 00
870: 00 00 00 00 00 00 00 00 00 00 00 00 00 00 00 00
880: 00 00 00 00 00 00 00 00 00 00 00 00 00 00 00 00
890: 00 00 00 00 00 00 00 00 00 00 00 00 00 00 00 00
8a0: 00 00 00 00 00 00 00 00 00 00 00 00 00 00 00 00
8b0: 00 00 00 00 00 00 00 00 00 00 00 00 00 00 00 00
8c0: 00 00 00 00 00 00 00 00 00 00 00 00 00 00 00 00
8d0: 00 00 00 00 00 00 00 00 00 00 00 00 00 00 00 00
8e0: 00 00 00 00 00 00 00 00 00 00 00 00 00 00 00 00
8f0: 00 00 00 00 00 00 00 00 00 00 00 00 00 00 00 00
900: 00 00 00 00 00 00 00 00 00 00 00 00 00 00 00 00
910: 00 00 00 00 00 00 00 00 00 00 00 00 00 00 00 00
920: 00 00 00 00 00 00 00 00 00 00 00 00 00 00 00 00
930: 00 00 00 00 00 00 00 00 00 00 00 00 00 00 00 00
940: 00 00 00 00 00 00 00 00 00 00 00 00 00 00 00 00
950: 00 00 00 00 00 00 00 00 00 00 00 00 00 00 00 00
960: 00 00 00 00 00 00 00 00 00 00 00 00 00 00 00 00
970: 00 00 00 00 00 00 00 00 00 00 00 00 00 00 00 00
980: 00 00 00 00 00 00 00 00 00 00 00 00 00 00 00 00
990: 00 00 00 00 00 00 00 00 00 00 00 00 00 00 00 00
9a0: 00 00 00 00 00 00 00 00 00 00 00 00 00 00 00 00
9b0: 00 00 00 00 00 00 00 00 00 00 00 00 00 00 00 00
9c0: 00 00 00 00 00 00 00 00 00 00 00 00 00 00 00 00
9d0: 00 00 00 00 00 00 00 00 00 00 00 00 00 00 00 00
9e0: 00 00 00 00 00 00 00 00 00 00 00 00 00 00 00 00
9f0: 00 00 00 00 00 00 00 00 00 00 00 00 00 00 00 00
a00: 00 00 00 00 00 00 00 00 00 00 00 00 00 00 00 00
a10: 00 00 00 00 00 00 00 00 00 00 00 00 00 00 00 00
a20: 00 00 00 00 00 00 00 00 00 00 00 00 00 00 00 00
a30: 00 00 00 00 00 00 00 00 00 00 00 00 00 00 00 00
a40: 00 00 00 00 00 00 00 00 00 00 00 00 00 00 00 00
a50: 00 00 00 00 00 00 00 00 00 00 00 00 00 00 00 00
a60: 00 00 00 00 00 00 00 00 00 00 00 00 00 00 00 00
a70: 00 00 00 00 00 00 00 00 00 00 00 00 00 00 00 00
a80: 00 00 00 00 00 00 00 00 00 00 00 00 00 00 00 00
a90: 00 00 00 00 00 00 00 00 00 00 00 00 00 00 00 00
aa0: 00 00 00 00 00 00 00 00 00 00 00 00 00 00 00 00
ab0: 00 00 00 00 00 00 00 00 00 00 00 00 00 00 00 00
ac0: 00 00 00 00 00 00 00 00 00 00 00 00 00 00 00 00
ad0: 00 00 00 00 00 00 00 00 00 00 00 00 00 00 00 00
ae0: 00 00 00 00 00 00 00 00 00 00 00 00 00 00 00 00
af0: 00 00 00 00 00 00 00 00 00 00 00 00 00 00 00 00
b00: 00 00 00 00 00 00 00 00 00 00 00 00 00 00 00 00
b10: 00 00 00 00 00 00 00 00 00 00 00 00 00 00 00 00
b20: 00 00 00 00 00 00 00 00 00 00 00 00 00 00 00 00
b30: 00 00 00 00 00 00 00 00 00 00 00 00 00 00 00 00
b40: 00 00 00 00 00 00 00 00 00 00 00 00 00 00 00 00
b50: 00 00 00 00 00 00 00 00 00 00 00 00 00 00 00 00
b60: 00 00 00 00 00 00 00 00 00 00 00 00 00 00 00 00
b70: 00 00 00 00 00 00 00 00 00 00 00 00 00 00 00 00
b80: 00 00 00 00 00 00 00 00 00 00 00 00 00 00 00 00
b90: 00 00 00 00 00 00 00 00 00 00 00 00 00 00 00 00
ba0: 00 00 00 00 00 00 00 00 00 00 00 00 00 00 00 00
bb0: 00 00 00 00 00 00 00 00 00 00 00 00 00 00 00 00
bc0: 00 00 00 00 00 00 00 00 00 00 00 00 00 00 00 00
bd0: 00 00 00 00 00 00 00 00 00 00 00 00 00 00 00 00
be0: 00 00 00 00 00 00 00 00 00 00 00 00 00 00 00 00
bf0: 00 00 00 00 00 00 00 00 00 00 00 00 00 00 00 00
c00: 00 00 00 00 00 00 00 00 00 00 00 00 00 00 00 00
c10: 00 00 00 00 00 00 00 00 00 00 00 00 00 00 00 00
c20: 00 00 00 00 00 00 00 00 00 00 00 00 00 00 00 00
c30: 00 00 00 00 00 00 00 00 00 00 00 00 00 00 00 00
c40: 00 00 00 00 00 00 00 00 00 00 00 00 00 00 00 00
c50: 00 00 00 00 00 00 00 00 00 00 00 00 00 00 00 00
c60: 00 00 00 00 00 00 00 00 00 00 00 00 00 00 00 00
c70: 00 00 00 00 00 00 00 00 00 00 00 00 00 00 00 00
c80: 00 00 00 00 00 00 00 00 00 00 00 00 00 00 00 00
c90: 00 00 00 00 00 00 00 00 00 00 00 00 00 00 00 00
ca0: 00 00 00 00 00 00 00 00 00 00 00 00 00 00 00 00
cb0: 00 00 00 00 00 00 00 00 00 00 00 00 00 00 00 00
cc0: 00 00 00 00 00 00 00 00 00 00 00 00 00 00 00 00
cd0: 00 00 00 00 00 00 00 00 00 00 00 00 00 00 00 00
ce0: 00 00 00 00 00 00 00 00 00 00 00 00 00 00 00 00
cf0: 00 00 00 00 00 00 00 00 00 00 00 00 00 00 00 00
d00: 00 00 00 00 00 00 00 00 00 00 00 00 00 00 00 00
d10: 00 00 00 00 00 00 00 00 00 00 00 00 00 00 00 00
d20: 00 00 00 00 00 00 00 00 00 00 00 00 00 00 00 00
d30: 00 00 00 00 00 00 00 00 00 00 00 00 00 00 00 00
d40: 00 00 00 00 00 00 00 00 00 00 00 00 00 00 00 00
d50: 00 00 00 00 00 00 00 00 00 00 00 00 00 00 00 00
d60: 00 00 00 00 00 00 00 00 00 00 00 00 00 00 00 00
d70: 00 00 00 00 00 00 00 00 00 00 00 00 00 00 00 00
d80: 00 00 00 00 00 00 00 00 00 00 00 00 00 00 00 00
d90: 00 00 00 00 00 00 00 00 00 00 00 00 00 00 00 00
da0: 00 00 00 00 00 00 00 00 00 00 00 00 00 00 00 00
db0: 00 00 00 00 00 00 00 00 00 00 00 00 00 00 00 00
dc0: 00 00 00 00 00 00 00 00 00 00 00 00 00 00 00 00
dd0: 00 00 00 00 00 00 00 00 00 00 00 00 00 00 00 00
de0: 00 00 00 00 00 00 00 00 00 00 00 00 00 00 00 00
df0: 00 00 00 00 00 00 00 00 00 00 00 00 00 00 00 00
e00: 00 00 00 00 00 00 00 00 00 00 00 00 00 00 00 00
e10: 00 00 00 00 00 00 00 00 00 00 00 00 00 00 00 00
e20: 00 00 00 00 00 00 00 00 00 00 00 00 00 00 00 00
e30: 00 00 00 00 00 00 00 00 00 00 00 00 00 00 00 00
e40: 00 00 00 00 00 00 00 00 00 00 00 00 00 00 00 00
e50: 00 00 00 00 00 00 00 00 00 00 00 00 00 00 00 00
e60: 00 00 00 00 00 00 00 00 00 00 00 00 00 00 00 00
e70: 00 00 00 00 00 00 00 00 00 00 00 00 00 00 00 00
e80: 00 00 00 00 00 00 00 00 00 00 00 00 00 00 00 00
e90: 00 00 00 00 00 00 00 00 00 00 00 00 00 00 00 00
ea0: 00 00 00 00 00 00 00 00 00 00 00 00 00 00 00 00
eb0: 00 00 00 00 00 00 00 00 00 00 00 00 00 00 00 00
ec0: 00 00 00 00 00 00 00 00 00 00 00 00 00 00 00 00
ed0: 00 00 00 00 00 00 00 00 00 00 00 00 00 00 00 00
ee0: 00 00 00 00 00 00 00 00 00 00 00 00 00 00 00 00
ef0: 00 00 00 00 00 00 00 00 00 00 00 00 00 00 00 00
f00: 00 00 00 00 00 00 00 00 00 00 00 00 00 00 00 00
f10: 00 00 00 00 00 00 00 00 00 00 00 00 00 00 00 00
f20: 00 00 00 00 00 00 00 00 00 00 00 00 00 00 00 00
f30: 00 00 00 00 00 00 00 00 00 00 00 00 00 00 00 00
f40: 00 00 00 00 00 00 00 00 00 00 00 00 00 00 00 00
f50: 00 00 00 00 00 00 00 00 00 00 00 00 00 00 00 00
f60: 00 00 00 00 00 00 00 00 00 00 00 00 00 00 00 00
f70: 00 00 00 00 00 00 00 00 00 00 00 00 00 00 00 00
f80: 00 00 00 00 00 00 00 00 00 00 00 00 00 00 00 00
f90: 00 00 00 00 00 00 00 00 00 00 00 00 00 00 00 00
fa0: 00 00 00 00 00 00 00 00 00 00 00 00 00 00 00 00
fb0: 00 00 00 00 00 00 00 00 00 00 00 00 00 00 00 00
fc0: 00 00 00 00 00 00 00 00 00 00 00 00 00 00 00 00
fd0: 00 00 00 00 00 00 00 00 00 00 00 00 00 00 00 00
fe0: 00 00 00 00 00 00 00 00 00 00 00 00 00 00 00 00
ff0: 00 00 00 00 00 00 00 00 00 00 00 00 00 00 00 00

00:1c.0 PCI bridge [0604]: Intel Corporation 82801I (ICH9 Family) PCI Express Port 1 [8086:2940] (rev 03) (prog-if 00 [Normal decode])
	Control: I/O+ Mem+ BusMaster+ SpecCycle- MemWINV- VGASnoop- ParErr- Stepping- SERR+ FastB2B- DisINTx+
	Status: Cap+ 66MHz- UDF- FastB2B- ParErr- DEVSEL=fast >TAbort- <TAbort- <MAbort- >SERR- <PERR- INTx-
	Latency: 0, Cache Line Size: 64 bytes
	Bus: primary=00, secondary=02, subordinate=02, sec-latency=0
	I/O behind bridge: 00003000-00003fff
	Memory behind bridge: bc000000-bc1fffff
	Prefetchable memory behind bridge: 00000000bc200000-00000000bc3fffff
	Secondary status: 66MHz- FastB2B- ParErr- DEVSEL=fast >TAbort- <TAbort- <MAbort+ <SERR- <PERR-
	BridgeCtl: Parity- SERR- NoISA+ VGA- MAbort- >Reset- FastB2B-
		PriDiscTmr- SecDiscTmr- DiscTmrStat- DiscTmrSERREn-
	Capabilities: [40] Express (v1) Root Port (Slot+), MSI 00
		DevCap:	MaxPayload 128 bytes, PhantFunc 0
			ExtTag- RBE+
		DevCtl:	Report errors: Correctable- Non-Fatal- Fatal- Unsupported-
			RlxdOrd- ExtTag- PhantFunc- AuxPwr- NoSnoop-
			MaxPayload 128 bytes, MaxReadReq 128 bytes
		DevSta:	CorrErr- UncorrErr- FatalErr- UnsuppReq- AuxPwr+ TransPend-
		LnkCap:	Port #1, Speed 2.5GT/s, Width x1, ASPM L0s L1, Exit Latency L0s <1us, L1 <4us
			ClockPM- Surprise- LLActRep+ BwNot-
		LnkCtl:	ASPM Disabled; RCB 64 bytes Disabled- CommClk-
			ExtSynch- ClockPM- AutWidDis- BWInt- AutBWInt-
		LnkSta:	Speed 2.5GT/s, Width x0, TrErr- Train- SlotClk+ DLActive- BWMgmt- ABWMgmt-
		SltCap:	AttnBtn- PwrCtrl- MRL- AttnInd- PwrInd- HotPlug+ Surprise+
			Slot #0, PowerLimit 6.500W; Interlock- NoCompl-
		SltCtl:	Enable: AttnBtn- PwrFlt- MRL- PresDet+ CmdCplt+ HPIrq+ LinkChg-
			Control: AttnInd Unknown, PwrInd Unknown, Power- Interlock-
		SltSta:	Status: AttnBtn- PowerFlt- MRL- CmdCplt- PresDet- Interlock-
			Changed: MRL- PresDet- LinkState-
		RootCtl: ErrCorrectable- ErrNon-Fatal- ErrFatal- PMEIntEna+ CRSVisible-
		RootCap: CRSVisible-
		RootSta: PME ReqID 0000, PMEStatus- PMEPending-
	Capabilities: [80] MSI: Enable+ Count=1/1 Maskable- 64bit-
		Address: fee0300c  Data: 41c1
	Capabilities: [90] Subsystem: Lenovo Device [17aa:20f3]
	Capabilities: [a0] Power Management version 2
		Flags: PMEClk- DSI- D1- D2- AuxCurrent=0mA PME(D0+,D1-,D2-,D3hot+,D3cold+)
		Status: D0 NoSoftRst- PME-Enable- DSel=0 DScale=0 PME-
	Capabilities: [100 v1] Virtual Channel
		Caps:	LPEVC=0 RefClk=100ns PATEntryBits=1
		Arb:	Fixed+ WRR32- WRR64- WRR128-
		Ctrl:	ArbSelect=Fixed
		Status:	InProgress-
		VC0:	Caps:	PATOffset=00 MaxTimeSlots=1 RejSnoopTrans-
			Arb:	Fixed+ WRR32- WRR64- WRR128- TWRR128- WRR256-
			Ctrl:	Enable+ ID=0 ArbSelect=Fixed TC/VC=ff
			Status:	NegoPending- InProgress-
	Capabilities: [180 v1] Root Complex Link
		Desc:	PortNumber=01 ComponentID=02 EltType=Config
		Link0:	Desc:	TargetPort=00 TargetComponent=02 AssocRCRB- LinkType=MemMapped LinkValid+
			Addr:	00000000fed1c000
	Kernel driver in use: pcieport
00: 86 80 40 29 07 05 10 00 03 00 04 06 10 00 81 00
10: 00 00 00 00 00 00 00 00 00 02 02 00 30 30 00 20
20: 00 bc 10 bc 21 bc 31 bc 00 00 00 00 00 00 00 00
30: 00 00 00 00 40 00 00 00 00 00 00 00 0b 01 04 00
40: 10 80 41 01 00 80 00 00 00 00 10 00 11 4c 11 01
50: 00 00 01 10 e0 a0 00 00 38 00 00 00 08 00 00 00
60: 00 00 00 00 00 00 00 00 00 00 00 00 00 00 00 00
70: 00 00 00 00 00 00 00 00 00 00 00 00 00 00 00 00
80: 05 90 01 00 0c 30 e0 fe c1 41 00 00 00 00 00 00
90: 0d a0 00 00 aa 17 f3 20 00 00 00 00 00 00 00 00
a0: 01 00 02 c8 00 00 00 00 00 00 00 00 00 00 00 00
b0: 00 00 00 00 00 00 00 00 00 00 00 00 00 00 00 00
c0: 00 00 00 00 00 00 00 00 00 00 00 00 00 00 00 00
d0: 00 00 00 00 00 00 00 00 00 00 11 08 00 00 00 00
e0: 00 0f c7 00 06 07 08 00 31 00 00 00 00 00 00 00
f0: 00 00 00 00 00 00 00 00 86 0f 04 00 00 00 00 00
100: 02 00 01 18 00 00 00 00 01 00 00 00 00 00 00 00
110: 01 00 00 00 ff 00 00 80 00 00 00 00 00 00 00 00
120: 00 00 00 00 00 00 00 00 00 00 00 00 00 00 00 00
130: 00 00 00 00 00 00 00 00 00 00 00 00 00 00 00 00
140: 00 00 00 00 00 00 00 00 00 00 00 00 11 00 06 00
150: 00 00 00 00 00 20 00 00 00 00 00 00 00 00 00 00
160: 00 00 00 00 00 00 00 00 00 00 00 00 00 00 00 00
170: 00 00 00 00 00 00 00 00 00 00 00 00 00 00 00 00
180: 05 00 01 00 00 01 02 01 00 00 00 00 00 00 00 00
190: 01 00 02 00 00 00 00 00 00 c0 d1 fe 00 00 00 00
1a0: 00 00 00 00 00 00 00 00 00 00 00 00 00 00 00 00
1b0: 00 00 00 00 00 00 00 00 00 00 00 00 00 00 00 00
1c0: 00 00 00 00 00 00 00 00 00 00 00 00 00 00 00 00
1d0: 00 00 00 00 00 00 00 00 00 00 00 00 00 00 00 00
1e0: 00 00 00 00 00 00 00 00 00 00 00 00 00 00 00 00
1f0: 00 00 00 00 00 00 00 00 00 00 00 00 00 00 00 00
200: 00 00 00 00 00 00 00 00 00 00 00 00 00 00 00 00
210: 00 00 00 00 00 00 00 00 00 00 00 00 00 00 00 00
220: 00 00 00 00 00 00 00 00 00 00 00 00 00 00 00 00
230: 00 00 00 00 00 00 00 00 00 00 00 00 00 00 00 00
240: 00 00 00 00 00 00 00 00 00 00 00 00 00 00 00 00
250: 00 00 00 00 00 00 00 00 00 00 00 00 00 00 00 00
260: 00 00 00 00 00 00 00 00 00 00 00 00 00 00 00 00
270: 00 00 00 00 00 00 00 00 00 00 00 00 00 00 00 00
280: 00 00 00 00 00 00 00 00 00 00 00 00 00 00 00 00
290: 00 00 00 00 00 00 00 00 00 00 00 00 00 00 00 00
2a0: 00 00 00 00 00 00 00 00 00 00 00 00 00 00 00 00
2b0: 00 00 00 00 00 00 00 00 00 00 00 00 00 00 00 00
2c0: 00 00 00 00 00 00 00 00 00 00 00 00 00 00 00 00
2d0: 00 00 00 00 00 00 00 00 00 00 00 00 00 00 00 00
2e0: 00 00 00 00 00 00 00 00 00 00 00 00 00 00 00 00
2f0: 00 00 00 00 00 00 00 00 00 00 00 00 00 00 00 00
300: 07 60 20 60 00 00 00 00 60 12 00 00 0c 00 06 00
310: 00 10 00 00 5b 60 c9 c0 00 70 26 75 00 10 00 00
320: ff 0f 00 00 40 00 00 14 b5 bc 4a bc 0b 2a 00 00
330: 00 00 00 00 00 00 00 00 00 00 00 00 00 00 00 00
340: 00 00 00 00 00 00 00 00 10 00 04 00 00 00 00 00
350: 00 00 00 00 01 00 04 00 00 00 00 00 00 00 00 00
360: 00 00 00 00 00 00 00 00 00 00 00 00 00 00 00 00
370: 00 00 00 00 00 00 00 00 00 00 00 00 00 00 00 00
380: 00 00 00 00 00 00 00 00 00 00 00 00 00 00 00 00
390: 00 00 00 00 00 00 00 00 00 00 00 00 00 00 00 00
3a0: 00 00 00 00 00 00 00 00 00 00 00 00 00 00 00 00
3b0: 00 00 00 00 00 00 00 00 00 00 00 00 00 00 00 00
3c0: 00 00 00 00 00 00 00 00 00 00 00 00 00 00 00 00
3d0: 00 00 00 00 00 00 00 00 00 00 00 00 00 00 00 00
3e0: 00 00 00 00 00 00 00 00 00 00 00 00 00 00 00 00
3f0: 00 00 00 00 00 00 00 00 00 00 00 00 00 00 00 00
400: 00 00 00 00 00 00 00 00 00 00 00 00 00 00 00 00
410: 00 00 00 00 00 00 00 00 00 00 00 00 00 00 00 00
420: 00 00 00 00 00 00 00 00 00 00 00 00 00 00 00 00
430: 00 00 00 00 00 00 00 00 00 00 00 00 00 00 00 00
440: 00 00 00 00 00 00 00 00 00 00 00 00 00 00 00 00
450: 00 00 00 00 00 00 00 00 00 00 00 00 00 00 00 00
460: 00 00 00 00 00 00 00 00 00 00 00 00 00 00 00 00
470: 00 00 00 00 00 00 00 00 00 00 00 00 00 00 00 00
480: 00 00 00 00 00 00 00 00 00 00 00 00 00 00 00 00
490: 00 00 00 00 00 00 00 00 00 00 00 00 00 00 00 00
4a0: 00 00 00 00 00 00 00 00 00 00 00 00 00 00 00 00
4b0: 00 00 00 00 00 00 00 00 00 00 00 00 00 00 00 00
4c0: 00 00 00 00 00 00 00 00 00 00 00 00 00 00 00 00
4d0: 00 00 00 00 00 00 00 00 00 00 00 00 00 00 00 00
4e0: 00 00 00 00 00 00 00 00 00 00 00 00 00 00 00 00
4f0: 00 00 00 00 00 00 00 00 00 00 00 00 00 00 00 00
500: 00 00 00 00 00 00 00 00 00 00 00 00 00 00 00 00
510: 00 00 00 00 00 00 00 00 00 00 00 00 00 00 00 00
520: 00 00 00 00 00 00 00 00 00 00 00 00 00 00 00 00
530: 00 00 00 00 00 00 00 00 00 00 00 00 00 00 00 00
540: 00 00 00 00 00 00 00 00 00 00 00 00 00 00 00 00
550: 00 00 00 00 00 00 00 00 00 00 00 00 00 00 00 00
560: 00 00 00 00 00 00 00 00 00 00 00 00 00 00 00 00
570: 00 00 00 00 00 00 00 00 00 00 00 00 00 00 00 00
580: 00 00 00 00 00 00 00 00 00 00 00 00 00 00 00 00
590: 00 00 00 00 00 00 00 00 00 00 00 00 00 00 00 00
5a0: 00 00 00 00 00 00 00 00 00 00 00 00 00 00 00 00
5b0: 00 00 00 00 00 00 00 00 00 00 00 00 00 00 00 00
5c0: 00 00 00 00 00 00 00 00 00 00 00 00 00 00 00 00
5d0: 00 00 00 00 00 00 00 00 00 00 00 00 00 00 00 00
5e0: 00 00 00 00 00 00 00 00 00 00 00 00 00 00 00 00
5f0: 00 00 00 00 00 00 00 00 00 00 00 00 00 00 00 00
600: 00 00 00 00 00 00 00 00 00 00 00 00 00 00 00 00
610: 00 00 00 00 00 00 00 00 00 00 00 00 00 00 00 00
620: 00 00 00 00 00 00 00 00 00 00 00 00 00 00 00 00
630: 00 00 00 00 00 00 00 00 00 00 00 00 00 00 00 00
640: 00 00 00 00 00 00 00 00 00 00 00 00 00 00 00 00
650: 00 00 00 00 00 00 00 00 00 00 00 00 00 00 00 00
660: 00 00 00 00 00 00 00 00 00 00 00 00 00 00 00 00
670: 00 00 00 00 00 00 00 00 00 00 00 00 00 00 00 00
680: 00 00 00 00 00 00 00 00 00 00 00 00 00 00 00 00
690: 00 00 00 00 00 00 00 00 00 00 00 00 00 00 00 00
6a0: 00 00 00 00 00 00 00 00 00 00 00 00 00 00 00 00
6b0: 00 00 00 00 00 00 00 00 00 00 00 00 00 00 00 00
6c0: 00 00 00 00 00 00 00 00 00 00 00 00 00 00 00 00
6d0: 00 00 00 00 00 00 00 00 00 00 00 00 00 00 00 00
6e0: 00 00 00 00 00 00 00 00 00 00 00 00 00 00 00 00
6f0: 00 00 00 00 00 00 00 00 00 00 00 00 00 00 00 00
700: 00 00 00 00 00 00 00 00 00 00 00 00 00 00 00 00
710: 00 00 00 00 00 00 00 00 00 00 00 00 00 00 00 00
720: 00 00 00 00 00 00 00 00 00 00 00 00 00 00 00 00
730: 00 00 00 00 00 00 00 00 00 00 00 00 00 00 00 00
740: 00 00 00 00 00 00 00 00 00 00 00 00 00 00 00 00
750: 00 00 00 00 00 00 00 00 00 00 00 00 00 00 00 00
760: 00 00 00 00 00 00 00 00 00 00 00 00 00 00 00 00
770: 00 00 00 00 00 00 00 00 00 00 00 00 00 00 00 00
780: 00 00 00 00 00 00 00 00 00 00 00 00 00 00 00 00
790: 00 00 00 00 00 00 00 00 00 00 00 00 00 00 00 00
7a0: 00 00 00 00 00 00 00 00 00 00 00 00 00 00 00 00
7b0: 00 00 00 00 00 00 00 00 00 00 00 00 00 00 00 00
7c0: 00 00 00 00 00 00 00 00 00 00 00 00 00 00 00 00
7d0: 00 00 00 00 00 00 00 00 00 00 00 00 00 00 00 00
7e0: 00 00 00 00 00 00 00 00 00 00 00 00 00 00 00 00
7f0: 00 00 00 00 00 00 00 00 00 00 00 00 00 00 00 00
800: 00 00 00 00 00 00 00 00 00 00 00 00 00 00 00 00
810: 00 00 00 00 00 00 00 00 00 00 00 00 00 00 00 00
820: 00 00 00 00 00 00 00 00 00 00 00 00 00 00 00 00
830: 00 00 00 00 00 00 00 00 00 00 00 00 00 00 00 00
840: 00 00 00 00 00 00 00 00 00 00 00 00 00 00 00 00
850: 00 00 00 00 00 00 00 00 00 00 00 00 00 00 00 00
860: 00 00 00 00 00 00 00 00 00 00 00 00 00 00 00 00
870: 00 00 00 00 00 00 00 00 00 00 00 00 00 00 00 00
880: 00 00 00 00 00 00 00 00 00 00 00 00 00 00 00 00
890: 00 00 00 00 00 00 00 00 00 00 00 00 00 00 00 00
8a0: 00 00 00 00 00 00 00 00 00 00 00 00 00 00 00 00
8b0: 00 00 00 00 00 00 00 00 00 00 00 00 00 00 00 00
8c0: 00 00 00 00 00 00 00 00 00 00 00 00 00 00 00 00
8d0: 00 00 00 00 00 00 00 00 00 00 00 00 00 00 00 00
8e0: 00 00 00 00 00 00 00 00 00 00 00 00 00 00 00 00
8f0: 00 00 00 00 00 00 00 00 00 00 00 00 00 00 00 00
900: 00 00 00 00 00 00 00 00 00 00 00 00 00 00 00 00
910: 00 00 00 00 00 00 00 00 00 00 00 00 00 00 00 00
920: 00 00 00 00 00 00 00 00 00 00 00 00 00 00 00 00
930: 00 00 00 00 00 00 00 00 00 00 00 00 00 00 00 00
940: 00 00 00 00 00 00 00 00 00 00 00 00 00 00 00 00
950: 00 00 00 00 00 00 00 00 00 00 00 00 00 00 00 00
960: 00 00 00 00 00 00 00 00 00 00 00 00 00 00 00 00
970: 00 00 00 00 00 00 00 00 00 00 00 00 00 00 00 00
980: 00 00 00 00 00 00 00 00 00 00 00 00 00 00 00 00
990: 00 00 00 00 00 00 00 00 00 00 00 00 00 00 00 00
9a0: 00 00 00 00 00 00 00 00 00 00 00 00 00 00 00 00
9b0: 00 00 00 00 00 00 00 00 00 00 00 00 00 00 00 00
9c0: 00 00 00 00 00 00 00 00 00 00 00 00 00 00 00 00
9d0: 00 00 00 00 00 00 00 00 00 00 00 00 00 00 00 00
9e0: 00 00 00 00 00 00 00 00 00 00 00 00 00 00 00 00
9f0: 00 00 00 00 00 00 00 00 00 00 00 00 00 00 00 00
a00: 00 00 00 00 00 00 00 00 00 00 00 00 00 00 00 00
a10: 00 00 00 00 00 00 00 00 00 00 00 00 00 00 00 00
a20: 00 00 00 00 00 00 00 00 00 00 00 00 00 00 00 00
a30: 00 00 00 00 00 00 00 00 00 00 00 00 00 00 00 00
a40: 00 00 00 00 00 00 00 00 00 00 00 00 00 00 00 00
a50: 00 00 00 00 00 00 00 00 00 00 00 00 00 00 00 00
a60: 00 00 00 00 00 00 00 00 00 00 00 00 00 00 00 00
a70: 00 00 00 00 00 00 00 00 00 00 00 00 00 00 00 00
a80: 00 00 00 00 00 00 00 00 00 00 00 00 00 00 00 00
a90: 00 00 00 00 00 00 00 00 00 00 00 00 00 00 00 00
aa0: 00 00 00 00 00 00 00 00 00 00 00 00 00 00 00 00
ab0: 00 00 00 00 00 00 00 00 00 00 00 00 00 00 00 00
ac0: 00 00 00 00 00 00 00 00 00 00 00 00 00 00 00 00
ad0: 00 00 00 00 00 00 00 00 00 00 00 00 00 00 00 00
ae0: 00 00 00 00 00 00 00 00 00 00 00 00 00 00 00 00
af0: 00 00 00 00 00 00 00 00 00 00 00 00 00 00 00 00
b00: 00 00 00 00 00 00 00 00 00 00 00 00 00 00 00 00
b10: 00 00 00 00 00 00 00 00 00 00 00 00 00 00 00 00
b20: 00 00 00 00 00 00 00 00 00 00 00 00 00 00 00 00
b30: 00 00 00 00 00 00 00 00 00 00 00 00 00 00 00 00
b40: 00 00 00 00 00 00 00 00 00 00 00 00 00 00 00 00
b50: 00 00 00 00 00 00 00 00 00 00 00 00 00 00 00 00
b60: 00 00 00 00 00 00 00 00 00 00 00 00 00 00 00 00
b70: 00 00 00 00 00 00 00 00 00 00 00 00 00 00 00 00
b80: 00 00 00 00 00 00 00 00 00 00 00 00 00 00 00 00
b90: 00 00 00 00 00 00 00 00 00 00 00 00 00 00 00 00
ba0: 00 00 00 00 00 00 00 00 00 00 00 00 00 00 00 00
bb0: 00 00 00 00 00 00 00 00 00 00 00 00 00 00 00 00
bc0: 00 00 00 00 00 00 00 00 00 00 00 00 00 00 00 00
bd0: 00 00 00 00 00 00 00 00 00 00 00 00 00 00 00 00
be0: 00 00 00 00 00 00 00 00 00 00 00 00 00 00 00 00
bf0: 00 00 00 00 00 00 00 00 00 00 00 00 00 00 00 00
c00: 00 00 00 00 00 00 00 00 00 00 00 00 00 00 00 00
c10: 00 00 00 00 00 00 00 00 00 00 00 00 00 00 00 00
c20: 00 00 00 00 00 00 00 00 00 00 00 00 00 00 00 00
c30: 00 00 00 00 00 00 00 00 00 00 00 00 00 00 00 00
c40: 00 00 00 00 00 00 00 00 00 00 00 00 00 00 00 00
c50: 00 00 00 00 00 00 00 00 00 00 00 00 00 00 00 00
c60: 00 00 00 00 00 00 00 00 00 00 00 00 00 00 00 00
c70: 00 00 00 00 00 00 00 00 00 00 00 00 00 00 00 00
c80: 00 00 00 00 00 00 00 00 00 00 00 00 00 00 00 00
c90: 00 00 00 00 00 00 00 00 00 00 00 00 00 00 00 00
ca0: 00 00 00 00 00 00 00 00 00 00 00 00 00 00 00 00
cb0: 00 00 00 00 00 00 00 00 00 00 00 00 00 00 00 00
cc0: 00 00 00 00 00 00 00 00 00 00 00 00 00 00 00 00
cd0: 00 00 00 00 00 00 00 00 00 00 00 00 00 00 00 00
ce0: 00 00 00 00 00 00 00 00 00 00 00 00 00 00 00 00
cf0: 00 00 00 00 00 00 00 00 00 00 00 00 00 00 00 00
d00: 00 00 00 00 00 00 00 00 00 00 00 00 00 00 00 00
d10: 00 00 00 00 00 00 00 00 00 00 00 00 00 00 00 00
d20: 00 00 00 00 00 00 00 00 00 00 00 00 00 00 00 00
d30: 00 00 00 00 00 00 00 00 00 00 00 00 00 00 00 00
d40: 00 00 00 00 00 00 00 00 00 00 00 00 00 00 00 00
d50: 00 00 00 00 00 00 00 00 00 00 00 00 00 00 00 00
d60: 00 00 00 00 00 00 00 00 00 00 00 00 00 00 00 00
d70: 00 00 00 00 00 00 00 00 00 00 00 00 00 00 00 00
d80: 00 00 00 00 00 00 00 00 00 00 00 00 00 00 00 00
d90: 00 00 00 00 00 00 00 00 00 00 00 00 00 00 00 00
da0: 00 00 00 00 00 00 00 00 00 00 00 00 00 00 00 00
db0: 00 00 00 00 00 00 00 00 00 00 00 00 00 00 00 00
dc0: 00 00 00 00 00 00 00 00 00 00 00 00 00 00 00 00
dd0: 00 00 00 00 00 00 00 00 00 00 00 00 00 00 00 00
de0: 00 00 00 00 00 00 00 00 00 00 00 00 00 00 00 00
df0: 00 00 00 00 00 00 00 00 00 00 00 00 00 00 00 00
e00: 00 00 00 00 00 00 00 00 00 00 00 00 00 00 00 00
e10: 00 00 00 00 00 00 00 00 00 00 00 00 00 00 00 00
e20: 00 00 00 00 00 00 00 00 00 00 00 00 00 00 00 00
e30: 00 00 00 00 00 00 00 00 00 00 00 00 00 00 00 00
e40: 00 00 00 00 00 00 00 00 00 00 00 00 00 00 00 00
e50: 00 00 00 00 00 00 00 00 00 00 00 00 00 00 00 00
e60: 00 00 00 00 00 00 00 00 00 00 00 00 00 00 00 00
e70: 00 00 00 00 00 00 00 00 00 00 00 00 00 00 00 00
e80: 00 00 00 00 00 00 00 00 00 00 00 00 00 00 00 00
e90: 00 00 00 00 00 00 00 00 00 00 00 00 00 00 00 00
ea0: 00 00 00 00 00 00 00 00 00 00 00 00 00 00 00 00
eb0: 00 00 00 00 00 00 00 00 00 00 00 00 00 00 00 00
ec0: 00 00 00 00 00 00 00 00 00 00 00 00 00 00 00 00
ed0: 00 00 00 00 00 00 00 00 00 00 00 00 00 00 00 00
ee0: 00 00 00 00 00 00 00 00 00 00 00 00 00 00 00 00
ef0: 00 00 00 00 00 00 00 00 00 00 00 00 00 00 00 00
f00: 00 00 00 00 00 00 00 00 00 00 00 00 00 00 00 00
f10: 00 00 00 00 00 00 00 00 00 00 00 00 00 00 00 00
f20: 00 00 00 00 00 00 00 00 00 00 00 00 00 00 00 00
f30: 00 00 00 00 00 00 00 00 00 00 00 00 00 00 00 00
f40: 00 00 00 00 00 00 00 00 00 00 00 00 00 00 00 00
f50: 00 00 00 00 00 00 00 00 00 00 00 00 00 00 00 00
f60: 00 00 00 00 00 00 00 00 00 00 00 00 00 00 00 00
f70: 00 00 00 00 00 00 00 00 00 00 00 00 00 00 00 00
f80: 00 00 00 00 00 00 00 00 00 00 00 00 00 00 00 00
f90: 00 00 00 00 00 00 00 00 00 00 00 00 00 00 00 00
fa0: 00 00 00 00 00 00 00 00 00 00 00 00 00 00 00 00
fb0: 00 00 00 00 00 00 00 00 00 00 00 00 00 00 00 00
fc0: 00 00 00 00 00 00 00 00 00 00 00 00 00 00 00 00
fd0: 00 00 00 00 00 00 00 00 00 00 00 00 00 00 00 00
fe0: 00 00 00 00 00 00 00 00 00 00 00 00 00 00 00 00
ff0: 00 00 00 00 00 00 00 00 00 00 00 00 00 00 00 00

00:1c.3 PCI bridge [0604]: Intel Corporation 82801I (ICH9 Family) PCI Express Port 4 [8086:2946] (rev 03) (prog-if 00 [Normal decode])
	Control: I/O+ Mem+ BusMaster+ SpecCycle- MemWINV- VGASnoop- ParErr- Stepping- SERR+ FastB2B- DisINTx+
	Status: Cap+ 66MHz- UDF- FastB2B- ParErr- DEVSEL=fast >TAbort- <TAbort- <MAbort- >SERR- <PERR- INTx-
	Latency: 0, Cache Line Size: 64 bytes
	Bus: primary=00, secondary=05, subordinate=0c, sec-latency=0
	I/O behind bridge: 00002000-00002fff
	Memory behind bridge: f0000000-f1ffffff
	Prefetchable memory behind bridge: 00000000f2800000-00000000f28fffff
	Secondary status: 66MHz- FastB2B- ParErr- DEVSEL=fast >TAbort- <TAbort- <MAbort+ <SERR- <PERR-
	BridgeCtl: Parity- SERR- NoISA+ VGA- MAbort- >Reset- FastB2B-
		PriDiscTmr- SecDiscTmr- DiscTmrStat- DiscTmrSERREn-
	Capabilities: [40] Express (v1) Root Port (Slot+), MSI 00
		DevCap:	MaxPayload 128 bytes, PhantFunc 0
			ExtTag- RBE+
		DevCtl:	Report errors: Correctable- Non-Fatal- Fatal- Unsupported-
			RlxdOrd- ExtTag- PhantFunc- AuxPwr- NoSnoop-
			MaxPayload 128 bytes, MaxReadReq 128 bytes
		DevSta:	CorrErr- UncorrErr- FatalErr- UnsuppReq- AuxPwr+ TransPend-
		LnkCap:	Port #4, Speed 2.5GT/s, Width x1, ASPM L0s L1, Exit Latency L0s <1us, L1 <4us
			ClockPM- Surprise- LLActRep+ BwNot-
		LnkCtl:	ASPM L0s L1 Enabled; RCB 64 bytes Disabled- CommClk-
			ExtSynch- ClockPM- AutWidDis- BWInt- AutBWInt-
		LnkSta:	Speed 2.5GT/s, Width x0, TrErr- Train- SlotClk+ DLActive- BWMgmt- ABWMgmt-
		SltCap:	AttnBtn- PwrCtrl- MRL- AttnInd- PwrInd- HotPlug+ Surprise+
			Slot #3, PowerLimit 6.500W; Interlock- NoCompl-
		SltCtl:	Enable: AttnBtn- PwrFlt- MRL- PresDet+ CmdCplt+ HPIrq+ LinkChg-
			Control: AttnInd Unknown, PwrInd Unknown, Power- Interlock-
		SltSta:	Status: AttnBtn- PowerFlt- MRL- CmdCplt- PresDet- Interlock-
			Changed: MRL- PresDet- LinkState-
		RootCtl: ErrCorrectable- ErrNon-Fatal- ErrFatal- PMEIntEna+ CRSVisible-
		RootCap: CRSVisible-
		RootSta: PME ReqID 0000, PMEStatus- PMEPending-
	Capabilities: [80] MSI: Enable+ Count=1/1 Maskable- 64bit-
		Address: fee0300c  Data: 41d1
	Capabilities: [90] Subsystem: Lenovo Device [17aa:20f3]
	Capabilities: [a0] Power Management version 2
		Flags: PMEClk- DSI- D1- D2- AuxCurrent=0mA PME(D0+,D1-,D2-,D3hot+,D3cold+)
		Status: D0 NoSoftRst- PME-Enable- DSel=0 DScale=0 PME-
	Capabilities: [100 v1] Virtual Channel
		Caps:	LPEVC=0 RefClk=100ns PATEntryBits=1
		Arb:	Fixed+ WRR32- WRR64- WRR128-
		Ctrl:	ArbSelect=Fixed
		Status:	InProgress-
		VC0:	Caps:	PATOffset=00 MaxTimeSlots=1 RejSnoopTrans-
			Arb:	Fixed+ WRR32- WRR64- WRR128- TWRR128- WRR256-
			Ctrl:	Enable+ ID=0 ArbSelect=Fixed TC/VC=01
			Status:	NegoPending- InProgress-
	Capabilities: [180 v1] Root Complex Link
		Desc:	PortNumber=04 ComponentID=02 EltType=Config
		Link0:	Desc:	TargetPort=00 TargetComponent=02 AssocRCRB- LinkType=MemMapped LinkValid+
			Addr:	00000000fed1c000
	Kernel driver in use: pcieport
00: 86 80 46 29 07 05 10 00 03 00 04 06 10 00 81 00
10: 00 00 00 00 00 00 00 00 00 05 0c 00 20 20 00 20
20: 00 f0 f0 f1 81 f2 81 f2 00 00 00 00 00 00 00 00
30: 00 00 00 00 40 00 00 00 00 00 00 00 0b 04 04 00
40: 10 80 41 01 00 80 00 00 00 00 10 00 11 4c 11 04
50: 03 00 01 10 e0 a0 18 00 38 00 00 00 08 00 00 00
60: 00 00 00 00 00 00 00 00 00 00 00 00 00 00 00 00
70: 00 00 00 00 00 00 00 00 00 00 00 00 00 00 00 00
80: 05 90 01 00 0c 30 e0 fe d1 41 00 00 00 00 00 00
90: 0d a0 00 00 aa 17 f3 20 00 00 00 00 00 00 00 00
a0: 01 00 02 c8 00 00 00 00 00 00 00 00 00 00 00 00
b0: 00 00 00 00 00 00 00 00 00 00 00 00 00 00 00 00
c0: 00 00 00 00 00 00 00 00 00 00 00 00 00 00 00 00
d0: 00 00 00 00 00 00 00 00 00 00 11 08 00 00 00 00
e0: 00 0f c7 00 06 07 08 00 33 00 00 00 00 00 00 00
f0: 00 00 00 00 00 00 00 00 86 0f 04 00 00 00 00 00
100: 02 00 01 18 00 00 00 00 01 00 00 00 00 00 00 00
110: 01 00 00 00 01 00 00 80 00 00 00 00 00 00 00 00
120: 00 00 00 00 00 00 00 00 00 00 00 00 00 00 00 00
130: 00 00 00 00 00 00 00 00 00 00 00 00 00 00 00 00
140: 00 00 00 00 00 00 00 00 00 40 00 00 11 00 06 00
150: 00 00 00 00 00 20 00 00 00 00 00 00 00 00 00 00
160: 00 00 00 00 00 00 00 00 00 00 00 00 00 00 00 00
170: 00 00 00 00 00 00 00 00 00 00 00 00 00 00 00 00
180: 05 00 01 00 00 01 02 04 00 00 00 00 00 00 00 00
190: 01 00 02 00 00 00 00 00 00 c0 d1 fe 00 00 00 00
1a0: 00 00 00 00 00 00 00 00 00 00 00 00 00 00 00 00
1b0: 00 00 00 00 00 00 00 00 00 00 00 00 00 00 00 00
1c0: 00 00 00 00 00 00 00 00 00 00 00 00 00 00 00 00
1d0: 00 00 00 00 00 00 00 00 00 00 00 00 00 00 00 00
1e0: 00 00 00 00 00 00 00 00 00 00 00 00 00 00 00 00
1f0: 00 00 00 00 00 00 00 00 00 00 00 00 00 00 00 00
200: 00 00 00 00 00 00 00 00 00 00 00 00 00 00 00 00
210: 00 00 00 00 00 00 00 00 00 00 00 00 00 00 00 00
220: 00 00 00 00 00 00 00 00 00 00 00 00 00 00 00 00
230: 00 00 00 00 00 00 00 00 00 00 00 00 00 00 00 00
240: 00 00 00 00 00 00 00 00 00 00 00 00 00 00 00 00
250: 00 00 00 00 00 00 00 00 00 00 00 00 00 00 00 00
260: 00 00 00 00 00 00 00 00 00 00 00 00 00 00 00 00
270: 00 00 00 00 00 00 00 00 00 00 00 00 00 00 00 00
280: 00 00 00 00 00 00 00 00 00 00 00 00 00 00 00 00
290: 00 00 00 00 00 00 00 00 00 00 00 00 00 00 00 00
2a0: 00 00 00 00 00 00 00 00 00 00 00 00 00 00 00 00
2b0: 00 00 00 00 00 00 00 00 00 00 00 00 00 00 00 00
2c0: 00 00 00 00 00 00 00 00 00 00 00 00 00 00 00 00
2d0: 00 00 00 00 00 00 00 00 00 00 00 00 00 00 00 00
2e0: 00 00 00 00 00 00 00 00 00 00 00 00 00 00 00 00
2f0: 00 00 00 00 00 00 00 00 00 00 00 00 00 00 00 00
300: 07 60 20 60 00 00 00 00 60 12 00 00 0c 00 06 00
310: 00 10 00 00 5b 60 c9 c0 00 70 26 75 00 10 00 00
320: ff 0f 00 00 40 00 00 14 b5 bc 4a bc 0b 2a 00 00
330: 00 00 00 00 00 00 00 00 00 00 00 00 00 00 00 00
340: 00 00 00 00 00 00 00 00 10 00 04 00 00 00 00 00
350: 00 00 00 00 01 00 04 00 00 00 00 00 00 00 00 00
360: 00 00 00 00 00 00 00 00 00 00 00 00 00 00 00 00
370: 00 00 00 00 00 00 00 00 00 00 00 00 00 00 00 00
380: 00 00 00 00 00 00 00 00 00 00 00 00 00 00 00 00
390: 00 00 00 00 00 00 00 00 00 00 00 00 00 00 00 00
3a0: 00 00 00 00 00 00 00 00 00 00 00 00 00 00 00 00
3b0: 00 00 00 00 00 00 00 00 00 00 00 00 00 00 00 00
3c0: 00 00 00 00 00 00 00 00 00 00 00 00 00 00 00 00
3d0: 00 00 00 00 00 00 00 00 00 00 00 00 00 00 00 00
3e0: 00 00 00 00 00 00 00 00 00 00 00 00 00 00 00 00
3f0: 00 00 00 00 00 00 00 00 00 00 00 00 00 00 00 00
400: 00 00 00 00 00 00 00 00 00 00 00 00 00 00 00 00
410: 00 00 00 00 00 00 00 00 00 00 00 00 00 00 00 00
420: 00 00 00 00 00 00 00 00 00 00 00 00 00 00 00 00
430: 00 00 00 00 00 00 00 00 00 00 00 00 00 00 00 00
440: 00 00 00 00 00 00 00 00 00 00 00 00 00 00 00 00
450: 00 00 00 00 00 00 00 00 00 00 00 00 00 00 00 00
460: 00 00 00 00 00 00 00 00 00 00 00 00 00 00 00 00
470: 00 00 00 00 00 00 00 00 00 00 00 00 00 00 00 00
480: 00 00 00 00 00 00 00 00 00 00 00 00 00 00 00 00
490: 00 00 00 00 00 00 00 00 00 00 00 00 00 00 00 00
4a0: 00 00 00 00 00 00 00 00 00 00 00 00 00 00 00 00
4b0: 00 00 00 00 00 00 00 00 00 00 00 00 00 00 00 00
4c0: 00 00 00 00 00 00 00 00 00 00 00 00 00 00 00 00
4d0: 00 00 00 00 00 00 00 00 00 00 00 00 00 00 00 00
4e0: 00 00 00 00 00 00 00 00 00 00 00 00 00 00 00 00
4f0: 00 00 00 00 00 00 00 00 00 00 00 00 00 00 00 00
500: 00 00 00 00 00 00 00 00 00 00 00 00 00 00 00 00
510: 00 00 00 00 00 00 00 00 00 00 00 00 00 00 00 00
520: 00 00 00 00 00 00 00 00 00 00 00 00 00 00 00 00
530: 00 00 00 00 00 00 00 00 00 00 00 00 00 00 00 00
540: 00 00 00 00 00 00 00 00 00 00 00 00 00 00 00 00
550: 00 00 00 00 00 00 00 00 00 00 00 00 00 00 00 00
560: 00 00 00 00 00 00 00 00 00 00 00 00 00 00 00 00
570: 00 00 00 00 00 00 00 00 00 00 00 00 00 00 00 00
580: 00 00 00 00 00 00 00 00 00 00 00 00 00 00 00 00
590: 00 00 00 00 00 00 00 00 00 00 00 00 00 00 00 00
5a0: 00 00 00 00 00 00 00 00 00 00 00 00 00 00 00 00
5b0: 00 00 00 00 00 00 00 00 00 00 00 00 00 00 00 00
5c0: 00 00 00 00 00 00 00 00 00 00 00 00 00 00 00 00
5d0: 00 00 00 00 00 00 00 00 00 00 00 00 00 00 00 00
5e0: 00 00 00 00 00 00 00 00 00 00 00 00 00 00 00 00
5f0: 00 00 00 00 00 00 00 00 00 00 00 00 00 00 00 00
600: 00 00 00 00 00 00 00 00 00 00 00 00 00 00 00 00
610: 00 00 00 00 00 00 00 00 00 00 00 00 00 00 00 00
620: 00 00 00 00 00 00 00 00 00 00 00 00 00 00 00 00
630: 00 00 00 00 00 00 00 00 00 00 00 00 00 00 00 00
640: 00 00 00 00 00 00 00 00 00 00 00 00 00 00 00 00
650: 00 00 00 00 00 00 00 00 00 00 00 00 00 00 00 00
660: 00 00 00 00 00 00 00 00 00 00 00 00 00 00 00 00
670: 00 00 00 00 00 00 00 00 00 00 00 00 00 00 00 00
680: 00 00 00 00 00 00 00 00 00 00 00 00 00 00 00 00
690: 00 00 00 00 00 00 00 00 00 00 00 00 00 00 00 00
6a0: 00 00 00 00 00 00 00 00 00 00 00 00 00 00 00 00
6b0: 00 00 00 00 00 00 00 00 00 00 00 00 00 00 00 00
6c0: 00 00 00 00 00 00 00 00 00 00 00 00 00 00 00 00
6d0: 00 00 00 00 00 00 00 00 00 00 00 00 00 00 00 00
6e0: 00 00 00 00 00 00 00 00 00 00 00 00 00 00 00 00
6f0: 00 00 00 00 00 00 00 00 00 00 00 00 00 00 00 00
700: 00 00 00 00 00 00 00 00 00 00 00 00 00 00 00 00
710: 00 00 00 00 00 00 00 00 00 00 00 00 00 00 00 00
720: 00 00 00 00 00 00 00 00 00 00 00 00 00 00 00 00
730: 00 00 00 00 00 00 00 00 00 00 00 00 00 00 00 00
740: 00 00 00 00 00 00 00 00 00 00 00 00 00 00 00 00
750: 00 00 00 00 00 00 00 00 00 00 00 00 00 00 00 00
760: 00 00 00 00 00 00 00 00 00 00 00 00 00 00 00 00
770: 00 00 00 00 00 00 00 00 00 00 00 00 00 00 00 00
780: 00 00 00 00 00 00 00 00 00 00 00 00 00 00 00 00
790: 00 00 00 00 00 00 00 00 00 00 00 00 00 00 00 00
7a0: 00 00 00 00 00 00 00 00 00 00 00 00 00 00 00 00
7b0: 00 00 00 00 00 00 00 00 00 00 00 00 00 00 00 00
7c0: 00 00 00 00 00 00 00 00 00 00 00 00 00 00 00 00
7d0: 00 00 00 00 00 00 00 00 00 00 00 00 00 00 00 00
7e0: 00 00 00 00 00 00 00 00 00 00 00 00 00 00 00 00
7f0: 00 00 00 00 00 00 00 00 00 00 00 00 00 00 00 00
800: 00 00 00 00 00 00 00 00 00 00 00 00 00 00 00 00
810: 00 00 00 00 00 00 00 00 00 00 00 00 00 00 00 00
820: 00 00 00 00 00 00 00 00 00 00 00 00 00 00 00 00
830: 00 00 00 00 00 00 00 00 00 00 00 00 00 00 00 00
840: 00 00 00 00 00 00 00 00 00 00 00 00 00 00 00 00
850: 00 00 00 00 00 00 00 00 00 00 00 00 00 00 00 00
860: 00 00 00 00 00 00 00 00 00 00 00 00 00 00 00 00
870: 00 00 00 00 00 00 00 00 00 00 00 00 00 00 00 00
880: 00 00 00 00 00 00 00 00 00 00 00 00 00 00 00 00
890: 00 00 00 00 00 00 00 00 00 00 00 00 00 00 00 00
8a0: 00 00 00 00 00 00 00 00 00 00 00 00 00 00 00 00
8b0: 00 00 00 00 00 00 00 00 00 00 00 00 00 00 00 00
8c0: 00 00 00 00 00 00 00 00 00 00 00 00 00 00 00 00
8d0: 00 00 00 00 00 00 00 00 00 00 00 00 00 00 00 00
8e0: 00 00 00 00 00 00 00 00 00 00 00 00 00 00 00 00
8f0: 00 00 00 00 00 00 00 00 00 00 00 00 00 00 00 00
900: 00 00 00 00 00 00 00 00 00 00 00 00 00 00 00 00
910: 00 00 00 00 00 00 00 00 00 00 00 00 00 00 00 00
920: 00 00 00 00 00 00 00 00 00 00 00 00 00 00 00 00
930: 00 00 00 00 00 00 00 00 00 00 00 00 00 00 00 00
940: 00 00 00 00 00 00 00 00 00 00 00 00 00 00 00 00
950: 00 00 00 00 00 00 00 00 00 00 00 00 00 00 00 00
960: 00 00 00 00 00 00 00 00 00 00 00 00 00 00 00 00
970: 00 00 00 00 00 00 00 00 00 00 00 00 00 00 00 00
980: 00 00 00 00 00 00 00 00 00 00 00 00 00 00 00 00
990: 00 00 00 00 00 00 00 00 00 00 00 00 00 00 00 00
9a0: 00 00 00 00 00 00 00 00 00 00 00 00 00 00 00 00
9b0: 00 00 00 00 00 00 00 00 00 00 00 00 00 00 00 00
9c0: 00 00 00 00 00 00 00 00 00 00 00 00 00 00 00 00
9d0: 00 00 00 00 00 00 00 00 00 00 00 00 00 00 00 00
9e0: 00 00 00 00 00 00 00 00 00 00 00 00 00 00 00 00
9f0: 00 00 00 00 00 00 00 00 00 00 00 00 00 00 00 00
a00: 00 00 00 00 00 00 00 00 00 00 00 00 00 00 00 00
a10: 00 00 00 00 00 00 00 00 00 00 00 00 00 00 00 00
a20: 00 00 00 00 00 00 00 00 00 00 00 00 00 00 00 00
a30: 00 00 00 00 00 00 00 00 00 00 00 00 00 00 00 00
a40: 00 00 00 00 00 00 00 00 00 00 00 00 00 00 00 00
a50: 00 00 00 00 00 00 00 00 00 00 00 00 00 00 00 00
a60: 00 00 00 00 00 00 00 00 00 00 00 00 00 00 00 00
a70: 00 00 00 00 00 00 00 00 00 00 00 00 00 00 00 00
a80: 00 00 00 00 00 00 00 00 00 00 00 00 00 00 00 00
a90: 00 00 00 00 00 00 00 00 00 00 00 00 00 00 00 00
aa0: 00 00 00 00 00 00 00 00 00 00 00 00 00 00 00 00
ab0: 00 00 00 00 00 00 00 00 00 00 00 00 00 00 00 00
ac0: 00 00 00 00 00 00 00 00 00 00 00 00 00 00 00 00
ad0: 00 00 00 00 00 00 00 00 00 00 00 00 00 00 00 00
ae0: 00 00 00 00 00 00 00 00 00 00 00 00 00 00 00 00
af0: 00 00 00 00 00 00 00 00 00 00 00 00 00 00 00 00
b00: 00 00 00 00 00 00 00 00 00 00 00 00 00 00 00 00
b10: 00 00 00 00 00 00 00 00 00 00 00 00 00 00 00 00
b20: 00 00 00 00 00 00 00 00 00 00 00 00 00 00 00 00
b30: 00 00 00 00 00 00 00 00 00 00 00 00 00 00 00 00
b40: 00 00 00 00 00 00 00 00 00 00 00 00 00 00 00 00
b50: 00 00 00 00 00 00 00 00 00 00 00 00 00 00 00 00
b60: 00 00 00 00 00 00 00 00 00 00 00 00 00 00 00 00
b70: 00 00 00 00 00 00 00 00 00 00 00 00 00 00 00 00
b80: 00 00 00 00 00 00 00 00 00 00 00 00 00 00 00 00
b90: 00 00 00 00 00 00 00 00 00 00 00 00 00 00 00 00
ba0: 00 00 00 00 00 00 00 00 00 00 00 00 00 00 00 00
bb0: 00 00 00 00 00 00 00 00 00 00 00 00 00 00 00 00
bc0: 00 00 00 00 00 00 00 00 00 00 00 00 00 00 00 00
bd0: 00 00 00 00 00 00 00 00 00 00 00 00 00 00 00 00
be0: 00 00 00 00 00 00 00 00 00 00 00 00 00 00 00 00
bf0: 00 00 00 00 00 00 00 00 00 00 00 00 00 00 00 00
c00: 00 00 00 00 00 00 00 00 00 00 00 00 00 00 00 00
c10: 00 00 00 00 00 00 00 00 00 00 00 00 00 00 00 00
c20: 00 00 00 00 00 00 00 00 00 00 00 00 00 00 00 00
c30: 00 00 00 00 00 00 00 00 00 00 00 00 00 00 00 00
c40: 00 00 00 00 00 00 00 00 00 00 00 00 00 00 00 00
c50: 00 00 00 00 00 00 00 00 00 00 00 00 00 00 00 00
c60: 00 00 00 00 00 00 00 00 00 00 00 00 00 00 00 00
c70: 00 00 00 00 00 00 00 00 00 00 00 00 00 00 00 00
c80: 00 00 00 00 00 00 00 00 00 00 00 00 00 00 00 00
c90: 00 00 00 00 00 00 00 00 00 00 00 00 00 00 00 00
ca0: 00 00 00 00 00 00 00 00 00 00 00 00 00 00 00 00
cb0: 00 00 00 00 00 00 00 00 00 00 00 00 00 00 00 00
cc0: 00 00 00 00 00 00 00 00 00 00 00 00 00 00 00 00
cd0: 00 00 00 00 00 00 00 00 00 00 00 00 00 00 00 00
ce0: 00 00 00 00 00 00 00 00 00 00 00 00 00 00 00 00
cf0: 00 00 00 00 00 00 00 00 00 00 00 00 00 00 00 00
d00: 00 00 00 00 00 00 00 00 00 00 00 00 00 00 00 00
d10: 00 00 00 00 00 00 00 00 00 00 00 00 00 00 00 00
d20: 00 00 00 00 00 00 00 00 00 00 00 00 00 00 00 00
d30: 00 00 00 00 00 00 00 00 00 00 00 00 00 00 00 00
d40: 00 00 00 00 00 00 00 00 00 00 00 00 00 00 00 00
d50: 00 00 00 00 00 00 00 00 00 00 00 00 00 00 00 00
d60: 00 00 00 00 00 00 00 00 00 00 00 00 00 00 00 00
d70: 00 00 00 00 00 00 00 00 00 00 00 00 00 00 00 00
d80: 00 00 00 00 00 00 00 00 00 00 00 00 00 00 00 00
d90: 00 00 00 00 00 00 00 00 00 00 00 00 00 00 00 00
da0: 00 00 00 00 00 00 00 00 00 00 00 00 00 00 00 00
db0: 00 00 00 00 00 00 00 00 00 00 00 00 00 00 00 00
dc0: 00 00 00 00 00 00 00 00 00 00 00 00 00 00 00 00
dd0: 00 00 00 00 00 00 00 00 00 00 00 00 00 00 00 00
de0: 00 00 00 00 00 00 00 00 00 00 00 00 00 00 00 00
df0: 00 00 00 00 00 00 00 00 00 00 00 00 00 00 00 00
e00: 00 00 00 00 00 00 00 00 00 00 00 00 00 00 00 00
e10: 00 00 00 00 00 00 00 00 00 00 00 00 00 00 00 00
e20: 00 00 00 00 00 00 00 00 00 00 00 00 00 00 00 00
e30: 00 00 00 00 00 00 00 00 00 00 00 00 00 00 00 00
e40: 00 00 00 00 00 00 00 00 00 00 00 00 00 00 00 00
e50: 00 00 00 00 00 00 00 00 00 00 00 00 00 00 00 00
e60: 00 00 00 00 00 00 00 00 00 00 00 00 00 00 00 00
e70: 00 00 00 00 00 00 00 00 00 00 00 00 00 00 00 00
e80: 00 00 00 00 00 00 00 00 00 00 00 00 00 00 00 00
e90: 00 00 00 00 00 00 00 00 00 00 00 00 00 00 00 00
ea0: 00 00 00 00 00 00 00 00 00 00 00 00 00 00 00 00
eb0: 00 00 00 00 00 00 00 00 00 00 00 00 00 00 00 00
ec0: 00 00 00 00 00 00 00 00 00 00 00 00 00 00 00 00
ed0: 00 00 00 00 00 00 00 00 00 00 00 00 00 00 00 00
ee0: 00 00 00 00 00 00 00 00 00 00 00 00 00 00 00 00
ef0: 00 00 00 00 00 00 00 00 00 00 00 00 00 00 00 00
f00: 00 00 00 00 00 00 00 00 00 00 00 00 00 00 00 00
f10: 00 00 00 00 00 00 00 00 00 00 00 00 00 00 00 00
f20: 00 00 00 00 00 00 00 00 00 00 00 00 00 00 00 00
f30: 00 00 00 00 00 00 00 00 00 00 00 00 00 00 00 00
f40: 00 00 00 00 00 00 00 00 00 00 00 00 00 00 00 00
f50: 00 00 00 00 00 00 00 00 00 00 00 00 00 00 00 00
f60: 00 00 00 00 00 00 00 00 00 00 00 00 00 00 00 00
f70: 00 00 00 00 00 00 00 00 00 00 00 00 00 00 00 00
f80: 00 00 00 00 00 00 00 00 00 00 00 00 00 00 00 00
f90: 00 00 00 00 00 00 00 00 00 00 00 00 00 00 00 00
fa0: 00 00 00 00 00 00 00 00 00 00 00 00 00 00 00 00
fb0: 00 00 00 00 00 00 00 00 00 00 00 00 00 00 00 00
fc0: 00 00 00 00 00 00 00 00 00 00 00 00 00 00 00 00
fd0: 00 00 00 00 00 00 00 00 00 00 00 00 00 00 00 00
fe0: 00 00 00 00 00 00 00 00 00 00 00 00 00 00 00 00
ff0: 00 00 00 00 00 00 00 00 00 00 00 00 00 00 00 00

00:1d.0 USB controller [0c03]: Intel Corporation 82801I (ICH9 Family) USB UHCI Controller #1 [8086:2934] (rev 03) (prog-if 00 [UHCI])
	Subsystem: Lenovo Device [17aa:20f0]
	Control: I/O+ Mem- BusMaster+ SpecCycle- MemWINV- VGASnoop- ParErr- Stepping- SERR- FastB2B- DisINTx-
	Status: Cap+ 66MHz- UDF- FastB2B+ ParErr- DEVSEL=medium >TAbort- <TAbort- <MAbort- >SERR- <PERR- INTx-
	Latency: 0
	Interrupt: pin A routed to IRQ 16
	Region 4: I/O ports at 18a0 [size=32]
	Capabilities: [50] PCI Advanced Features
		AFCap: TP+ FLR+
		AFCtrl: FLR-
		AFStatus: TP-
	Kernel driver in use: uhci_hcd
00: 86 80 34 29 05 00 90 02 03 00 03 0c 00 00 80 00
10: 00 00 00 00 00 00 00 00 00 00 00 00 00 00 00 00
20: a1 18 00 00 00 00 00 00 00 00 00 00 aa 17 f0 20
30: 00 00 00 00 50 00 00 00 00 00 00 00 0b 01 00 00
40: 00 00 00 00 00 00 00 00 00 00 00 00 00 00 00 00
50: 13 00 06 03 00 00 00 00 00 00 00 00 00 00 00 00
60: 10 00 00 00 00 00 00 00 00 00 00 00 00 00 00 00
70: 00 00 00 00 00 00 00 00 00 00 00 00 00 00 00 00
80: 00 00 00 00 00 00 00 00 00 00 00 00 00 00 00 00
90: 00 00 00 00 00 00 00 00 00 00 00 00 00 00 00 00
a0: 00 00 00 00 00 00 00 00 00 00 00 00 00 00 00 00
b0: 00 00 00 00 00 00 00 00 00 00 00 00 00 00 00 00
c0: 00 2f 00 00 00 00 00 00 00 00 01 00 00 00 00 00
d0: 00 00 00 00 00 00 00 00 00 00 00 00 00 00 00 00
e0: 00 00 00 00 00 00 00 00 00 00 00 00 00 00 00 00
f0: 00 00 00 00 00 00 00 00 86 0f 04 00 00 00 00 00

00:1d.1 USB controller [0c03]: Intel Corporation 82801I (ICH9 Family) USB UHCI Controller #2 [8086:2935] (rev 03) (prog-if 00 [UHCI])
	Subsystem: Lenovo Device [17aa:20f0]
	Control: I/O+ Mem- BusMaster+ SpecCycle- MemWINV- VGASnoop- ParErr- Stepping- SERR- FastB2B- DisINTx-
	Status: Cap+ 66MHz- UDF- FastB2B+ ParErr- DEVSEL=medium >TAbort- <TAbort- <MAbort- >SERR- <PERR- INTx-
	Latency: 0
	Interrupt: pin B routed to IRQ 17
	Region 4: I/O ports at 18c0 [size=32]
	Capabilities: [50] PCI Advanced Features
		AFCap: TP+ FLR+
		AFCtrl: FLR-
		AFStatus: TP-
	Kernel driver in use: uhci_hcd
00: 86 80 35 29 05 00 90 02 03 00 03 0c 00 00 00 00
10: 00 00 00 00 00 00 00 00 00 00 00 00 00 00 00 00
20: c1 18 00 00 00 00 00 00 00 00 00 00 aa 17 f0 20
30: 00 00 00 00 50 00 00 00 00 00 00 00 0b 02 00 00
40: 00 00 00 00 00 00 00 00 00 00 00 00 00 00 00 00
50: 13 00 06 03 00 00 00 00 00 00 00 00 00 00 00 00
60: 10 00 00 00 00 00 00 00 00 00 00 00 00 00 00 00
70: 00 00 00 00 00 00 00 00 00 00 00 00 00 00 00 00
80: 00 00 00 00 00 00 00 00 00 00 00 00 00 00 00 00
90: 00 00 00 00 00 00 00 00 00 00 00 00 00 00 00 00
a0: 00 00 00 00 00 00 00 00 00 00 00 00 00 00 00 00
b0: 00 00 00 00 00 00 00 00 00 00 00 00 00 00 00 00
c0: 00 2f 00 00 00 00 00 00 00 00 01 00 00 00 00 00
d0: 00 00 00 00 00 00 00 00 00 00 00 00 00 00 00 00
e0: 00 00 00 00 00 00 00 00 00 00 00 00 00 00 00 00
f0: 00 00 00 00 00 00 00 00 86 0f 04 00 00 00 00 00

00:1d.2 USB controller [0c03]: Intel Corporation 82801I (ICH9 Family) USB UHCI Controller #3 [8086:2936] (rev 03) (prog-if 00 [UHCI])
	Subsystem: Lenovo Device [17aa:20f0]
	Control: I/O+ Mem- BusMaster+ SpecCycle- MemWINV- VGASnoop- ParErr- Stepping- SERR- FastB2B- DisINTx-
	Status: Cap+ 66MHz- UDF- FastB2B+ ParErr- DEVSEL=medium >TAbort- <TAbort- <MAbort- >SERR- <PERR- INTx-
	Latency: 0
	Interrupt: pin C routed to IRQ 18
	Region 4: I/O ports at 18e0 [size=32]
	Capabilities: [50] PCI Advanced Features
		AFCap: TP+ FLR+
		AFCtrl: FLR-
		AFStatus: TP-
	Kernel driver in use: uhci_hcd
00: 86 80 36 29 05 00 90 02 03 00 03 0c 00 00 00 00
10: 00 00 00 00 00 00 00 00 00 00 00 00 00 00 00 00
20: e1 18 00 00 00 00 00 00 00 00 00 00 aa 17 f0 20
30: 00 00 00 00 50 00 00 00 00 00 00 00 0b 03 00 00
40: 00 00 00 00 00 00 00 00 00 00 00 00 00 00 00 00
50: 13 00 06 03 00 00 00 00 00 00 00 00 00 00 00 00
60: 10 00 00 00 00 00 00 00 00 00 00 00 00 00 00 00
70: 00 00 00 00 00 00 00 00 00 00 00 00 00 00 00 00
80: 00 00 00 00 00 00 00 00 00 00 00 00 00 00 00 00
90: 00 00 00 00 00 00 00 00 00 00 00 00 00 00 00 00
a0: 00 00 00 00 00 00 00 00 00 00 00 00 00 00 00 00
b0: 00 00 00 00 00 00 00 00 00 00 00 00 00 00 00 00
c0: 00 2f 00 00 00 00 00 00 00 00 01 00 00 00 00 00
d0: 00 00 00 00 00 00 00 00 00 00 00 00 00 00 00 00
e0: 00 00 00 00 00 00 00 00 00 00 00 00 00 00 00 00
f0: 00 00 00 00 00 00 00 00 86 0f 04 00 00 00 00 00

00:1d.7 USB controller [0c03]: Intel Corporation 82801I (ICH9 Family) USB2 EHCI Controller #1 [8086:293a] (rev 03) (prog-if 20 [EHCI])
	Subsystem: Lenovo Device [17aa:20f1]
	Control: I/O- Mem+ BusMaster+ SpecCycle- MemWINV- VGASnoop- ParErr- Stepping- SERR+ FastB2B- DisINTx-
	Status: Cap+ 66MHz- UDF- FastB2B+ ParErr- DEVSEL=medium >TAbort- <TAbort- <MAbort- >SERR- <PERR- INTx-
	Latency: 0
	Interrupt: pin D routed to IRQ 19
	Region 0: Memory at f2726000 (32-bit, non-prefetchable) [size=1K]
	Capabilities: [50] Power Management version 2
		Flags: PMEClk- DSI- D1- D2- AuxCurrent=375mA PME(D0+,D1-,D2-,D3hot+,D3cold+)
		Status: D0 NoSoftRst- PME-Enable- DSel=0 DScale=0 PME-
	Capabilities: [58] Debug port: BAR=1 offset=00a0
	Capabilities: [98] PCI Advanced Features
		AFCap: TP+ FLR+
		AFCtrl: FLR-
		AFStatus: TP-
	Kernel driver in use: ehci-pci
00: 86 80 3a 29 06 01 90 02 03 20 03 0c 00 00 00 00
10: 00 60 72 f2 00 00 00 00 00 00 00 00 00 00 00 00
20: 00 00 00 00 00 00 00 00 00 00 00 00 aa 17 f1 20
30: 00 00 00 00 50 00 00 00 00 00 00 00 0b 04 00 00
40: 00 00 00 00 00 00 00 00 00 00 00 00 00 00 00 00
50: 01 58 c2 c9 00 00 00 00 0a 98 a0 20 00 00 00 00
60: 20 20 9f 00 00 00 00 00 01 00 00 01 00 00 08 c0
70: c0 00 1f 0f 00 00 00 00 00 00 00 00 00 00 00 00
80: 00 00 00 00 01 00 00 00 00 00 00 00 00 00 00 00
90: 00 00 00 00 00 00 00 00 13 00 06 03 00 00 00 00
a0: 00 00 00 00 00 00 00 00 00 00 00 00 00 00 00 00
b0: 00 00 00 00 00 00 00 00 00 00 00 00 00 00 00 00
c0: 00 00 00 00 00 00 00 00 00 00 00 00 00 00 00 00
d0: 00 00 00 00 00 aa ff 00 00 00 00 00 00 00 00 00
e0: 00 00 00 00 00 00 00 00 00 00 00 00 00 00 00 00
f0: 00 00 00 00 88 85 40 00 86 0f 04 00 06 17 02 20

00:1e.0 PCI bridge [0604]: Intel Corporation 82801 Mobile PCI Bridge [8086:2448] (rev 93) (prog-if 01 [Subtractive decode])
	Control: I/O+ Mem+ BusMaster+ SpecCycle- MemWINV- VGASnoop- ParErr- Stepping- SERR+ FastB2B- DisINTx-
	Status: Cap+ 66MHz- UDF- FastB2B- ParErr- DEVSEL=fast >TAbort- <TAbort- <MAbort- >SERR- <PERR- INTx-
	Latency: 0
	Bus: primary=00, secondary=0d, subordinate=0d, sec-latency=0
	I/O behind bridge: 0000f000-00000fff
	Memory behind bridge: fff00000-000fffff
	Prefetchable memory behind bridge: 00000000fff00000-00000000000fffff
	Secondary status: 66MHz- FastB2B+ ParErr- DEVSEL=medium >TAbort- <TAbort- <MAbort+ <SERR- <PERR-
	BridgeCtl: Parity- SERR- NoISA+ VGA- MAbort- >Reset- FastB2B-
		PriDiscTmr- SecDiscTmr- DiscTmrStat- DiscTmrSERREn-
	Capabilities: [50] Subsystem: Lenovo Device [17aa:20f4]
00: 86 80 48 24 07 01 10 00 93 01 04 06 00 00 01 00
10: 00 00 00 00 00 00 00 00 00 0d 0d 00 f0 00 80 22
20: f0 ff 00 00 f1 ff 01 00 00 00 00 00 00 00 00 00
30: 00 00 00 00 50 00 00 00 00 00 00 00 ff 00 04 00
40: 00 00 00 00 00 00 00 00 00 00 00 00 00 12 00 00
50: 0d 00 00 00 aa 17 f4 20 00 00 00 00 00 00 00 00
60: 00 00 00 00 00 00 00 00 00 00 00 00 00 00 00 00
70: 00 00 00 00 00 00 00 00 00 00 00 00 00 00 00 00
80: 00 00 00 00 00 00 00 00 00 00 00 00 00 00 00 00
90: 00 00 00 00 00 00 00 00 00 00 00 00 00 00 00 00
a0: 00 00 00 00 00 00 00 00 00 00 00 00 00 00 00 00
b0: 00 00 00 00 00 00 00 00 00 00 00 00 00 00 00 00
c0: 00 00 00 00 00 00 00 00 00 00 00 00 00 00 00 00
d0: 00 00 00 00 00 00 00 00 00 00 00 00 00 00 00 00
e0: 00 00 00 00 00 00 00 00 00 00 00 00 00 00 00 00
f0: 00 00 00 00 00 00 00 00 86 0f 04 00 00 00 00 00

00:1f.0 ISA bridge [0601]: Intel Corporation ICH9M LPC Interface Controller [8086:2919] (rev 03)
	Subsystem: Lenovo Device [17aa:20f6]
	Control: I/O+ Mem+ BusMaster+ SpecCycle- MemWINV- VGASnoop- ParErr- Stepping- SERR- FastB2B- DisINTx-
	Status: Cap+ 66MHz- UDF- FastB2B- ParErr- DEVSEL=medium >TAbort- <TAbort- <MAbort- >SERR- <PERR- INTx-
	Latency: 0
	Capabilities: [e0] Vendor Specific Information: Len=0c <?>
	Kernel driver in use: lpc_ich
00: 86 80 19 29 07 00 10 02 03 00 01 06 00 00 80 00
10: 00 00 00 00 00 00 00 00 00 00 00 00 00 00 00 00
20: 00 00 00 00 00 00 00 00 00 00 00 00 aa 17 f6 20
30: 00 00 00 00 e0 00 00 00 00 00 00 00 00 00 00 00
40: 01 10 00 00 80 00 00 00 81 11 00 00 10 00 00 00
50: 00 00 00 00 00 00 00 00 00 00 00 00 00 00 00 00
60: 8b 8b 8b 8b 90 00 00 00 8b 8b 8b 8b f8 00 00 00
70: 00 00 00 00 00 00 00 00 00 00 00 00 00 00 00 00
80: 10 00 0f 3f 01 16 7c 00 e1 15 0c 00 81 16 1c 00
90: 00 00 00 00 00 00 00 00 00 00 00 00 00 00 00 00
a0: 24 0a 00 00 39 00 80 00 2b 1c 0a 00 00 03 00 40
b0: 00 00 f0 00 00 00 00 00 08 00 02 00 00 00 00 00
c0: 00 00 00 00 00 00 00 00 00 00 00 00 00 00 00 00
d0: 00 00 00 00 67 45 00 00 00 ff 00 00 00 00 00 00
e0: 09 00 0c 10 20 02 24 03 64 00 00 00 00 00 00 00
f0: 01 c0 d1 fe 00 00 00 00 86 0f 04 00 00 00 00 00

00:1f.2 SATA controller [0106]: Intel Corporation 82801IBM/IEM (ICH9M/ICH9M-E) 4 port SATA Controller [AHCI mode] [8086:2929] (rev 03) (prog-if 01 [AHCI 1.0])
	Subsystem: Lenovo Device [17aa:20f8]
	Control: I/O+ Mem+ BusMaster+ SpecCycle- MemWINV- VGASnoop- ParErr- Stepping- SERR- FastB2B- DisINTx+
	Status: Cap+ 66MHz+ UDF- FastB2B+ ParErr- DEVSEL=medium >TAbort- <TAbort- <MAbort- >SERR- <PERR- INTx-
	Latency: 0
	Interrupt: pin B routed to IRQ 42
	Region 0: I/O ports at 1818 [size=8]
	Region 1: I/O ports at 180c [size=4]
	Region 2: I/O ports at 1810 [size=8]
	Region 3: I/O ports at 1808 [size=4]
	Region 4: I/O ports at 1c00 [size=32]
	Region 5: Memory at f2725000 (32-bit, non-prefetchable) [size=2K]
	Capabilities: [80] MSI: Enable+ Count=1/16 Maskable- 64bit-
		Address: fee0300c  Data: 41e1
	Capabilities: [70] Power Management version 3
		Flags: PMEClk- DSI- D1- D2- AuxCurrent=0mA PME(D0-,D1-,D2-,D3hot+,D3cold-)
		Status: D0 NoSoftRst+ PME-Enable- DSel=0 DScale=0 PME-
	Capabilities: [a8] SATA HBA v1.0 BAR4 Offset=00000004
	Capabilities: [b0] PCI Advanced Features
		AFCap: TP+ FLR+
		AFCtrl: FLR-
		AFStatus: TP-
	Kernel driver in use: ahci
00: 86 80 29 29 07 04 b0 02 03 01 06 01 00 00 00 00
10: 19 18 00 00 0d 18 00 00 11 18 00 00 09 18 00 00
20: 01 1c 00 00 00 50 72 f2 00 00 00 00 aa 17 f8 20
30: 00 00 00 00 80 00 00 00 00 00 00 00 0b 02 00 00
40: 00 80 00 80 00 00 00 00 00 00 00 00 00 00 00 00
50: 00 00 00 00 00 00 00 00 00 00 00 00 00 00 00 00
60: 00 00 00 00 00 00 00 00 00 00 00 00 00 00 00 00
70: 01 a8 03 40 08 00 00 00 00 00 00 00 00 00 00 00
80: 05 70 09 00 0c 30 e0 fe e1 41 00 00 00 00 00 00
90: 60 0c 03 81 93 01 00 4c 00 00 00 00 0c 00 00 00
a0: 00 00 00 00 00 00 00 00 12 b0 10 00 48 00 00 00
b0: 13 00 06 03 00 00 00 00 00 00 00 00 00 00 00 00
c0: 00 00 00 00 01 00 00 00 00 00 00 00 00 00 00 00
d0: 00 00 00 00 00 00 00 00 00 00 00 00 00 00 00 00
e0: 00 00 00 00 00 00 00 00 00 00 00 00 00 00 00 00
f0: 00 00 00 00 00 00 00 00 86 0f 04 00 00 00 00 00

00:1f.3 SMBus [0c05]: Intel Corporation 82801I (ICH9 Family) SMBus Controller [8086:2930] (rev 03)
	Subsystem: Lenovo Device [17aa:20f9]
	Control: I/O+ Mem+ BusMaster- SpecCycle- MemWINV- VGASnoop- ParErr- Stepping- SERR+ FastB2B- DisINTx-
	Status: Cap- 66MHz- UDF- FastB2B+ ParErr- DEVSEL=medium >TAbort- <TAbort- <MAbort- >SERR- <PERR- INTx-
	Interrupt: pin A routed to IRQ 11
	Region 0: Memory at f2726400 (64-bit, non-prefetchable) [size=256]
	Region 4: I/O ports at 1c20 [size=32]
00: 86 80 30 29 03 01 80 02 03 00 05 0c 00 00 00 00
10: 04 64 72 f2 00 00 00 00 00 00 00 00 00 00 00 00
20: 21 1c 00 00 00 00 00 00 00 00 00 00 aa 17 f9 20
30: 00 00 00 00 00 00 00 00 00 00 00 00 0b 01 00 00
40: 01 00 00 00 00 00 00 00 00 00 00 00 00 00 00 00
50: 00 00 00 00 00 00 00 00 00 00 00 00 00 00 00 00
60: 02 04 04 00 f0 00 08 08 00 00 00 00 00 00 00 00
70: 00 00 00 00 00 00 00 00 00 00 00 00 00 00 00 00
80: 04 00 00 00 00 00 00 00 00 00 00 00 00 00 00 00
90: 00 00 00 00 00 00 00 00 00 00 00 00 00 00 00 00
a0: 00 00 00 00 00 00 00 00 00 00 00 00 00 00 00 00
b0: 00 00 00 00 00 00 00 00 00 00 00 00 00 00 00 00
c0: 00 00 00 00 00 00 00 00 00 00 00 00 00 00 00 00
d0: 00 00 00 00 00 00 00 00 00 00 00 00 00 00 00 00
e0: 00 00 00 00 00 00 00 00 00 00 00 00 00 00 00 00
f0: 00 00 00 00 00 00 00 00 86 0f 04 00 00 00 00 00

